"id";"title";"pages";"year";"date";"url";"conference_name";"count"
1782;"A Petri Net Siphon Based Solution to Protocol-Level Service Composition Mismatches.";"952-958";2009;"2015-08-20";"http://doi.ieeecomputersociety.org/10.1109/ICWS.2009.108";"ICWS";0
1783;"Automated Testing and Response Analysis ofWeb Services.";"647-654";2007;"2015-08-20";"http://doi.ieeecomputersociety.org/10.1109/ICWS.2007.49";"ICWS";0
1784;"Discovery of Semantic Web Service Flow Based on Computation.";"319-326";2009;"2015-08-20";"http://doi.ieeecomputersociety.org/10.1109/ICWS.2009.81";"ICWS";0
1785;"Data Mining from NoSQL Document-Append Style Storages.";"385-392";2014;"2015-08-20";"http://doi.ieeecomputersociety.org/10.1109/ICWS.2014.62";"ICWS";0
1786;"Domain Objects for Continuous Context-Aware Adaptation of Service-Based Systems.";"571-578";2013;"2015-08-20";"http://doi.ieeecomputersociety.org/10.1109/ICWS.2013.82";"ICWS";0
1787;"A Two Steps Method For Analyzing Dependency of Business Services On IT Services Within A Service Life Cycle.";"877-884";2006;"2015-08-20";"http://doi.ieeecomputersociety.org/10.1109/ICWS.2006.17";"ICWS";0
1788;"SLA-Aware Tenant Placement and Dynamic Resource Provision in SaaS.";"615-622";2015;"2015-08-19";"http://dx.doi.org/10.1109/ICWS.2015.87";"ICWS";0
1789;"Metadata-Based XML Serialization for Embedded C++.";"347-356";2006;"2015-08-20";"http://doi.ieeecomputersociety.org/10.1109/ICWS.2006.91";"ICWS";0
1790;"WS-QDL Containing Static, Dynamic, and Statistical Factors of Web Services Quality.";"808-807";2004;"2015-08-20";"http://doi.ieeecomputersociety.org/10.1109/ICWS.2004.1314829";"ICWS";0
1791;"WS-OBJECTS: Extending Service-Oriented Architecture with Hierarchical Composition of Client-Side Asynchronous Event-Processing Logic.";"25-34";2009;"2015-08-20";"http://doi.ieeecomputersociety.org/10.1109/ICWS.2009.115";"ICWS";0
1792;"Service Composition in Multi-domain Environment under Time Constraint.";"227-234";2013;"2015-08-20";"http://doi.ieeecomputersociety.org/10.1109/ICWS.2013.39";"ICWS";0
1793;"Context Model Based SOA Policy Framework.";"608-615";2010;"2015-08-20";"http://doi.ieeecomputersociety.org/10.1109/ICWS.2010.115";"ICWS";0
1794;"A Method to Extend BPEL4WS to Enable Business Performance Measurement.";"46-54";2003;"2003-10-17";" ";"ICWS";0
1795;"Nomads - Enabling Distributed Analytical Service Environments for the Smart City Domain.";"679-685";2015;"2015-08-19";"http://dx.doi.org/10.1109/ICWS.2015.95";"ICWS";0
1796;"Toward Fundamental Primitives and Infrastructure Enhancements for Distributed Web Object Coordination and Workflows.";"819-820";2005;"2015-08-20";"http://doi.ieeecomputersociety.org/10.1109/ICWS.2005.120";"ICWS";0
1797;"Frequent Pattern Mining Using Semantic FP-Growth for Effective Web Service Ranking.";"725-727";2014;"2015-08-20";"http://doi.ieeecomputersociety.org/10.1109/ICWS.2014.116";"ICWS";0
1798;"A Gateway for Grid Services Access.";"353-358";2003;"2003-10-17";" ";"ICWS";0
1799;"Mobile SOA: Service Orientation on Lightweight Mobile Devices.";"1224-1225";2007;"2015-08-20";"http://doi.ieeecomputersociety.org/10.1109/ICWS.2007.121";"ICWS";0
1800;"Analyzing the Evolution of Web Services Using Fine-Grained Changes.";"392-399";2012;"2015-08-20";"http://doi.ieeecomputersociety.org/10.1109/ICWS.2012.29";"ICWS";0
1801;"Measuring Credit of Web Service.";"423-430";2014;"2015-08-20";"http://doi.ieeecomputersociety.org/10.1109/ICWS.2014.67";"ICWS";0
1802;"Dynamic Web Service Composition within a Service-Oriented Architecture.";"304-311";2007;"2015-08-20";"http://doi.ieeecomputersociety.org/10.1109/ICWS.2007.79";"ICWS";0
1803;"Program Committee.";"not available";2006;"2015-08-20";"http://doi.ieeecomputersociety.org/10.1109/ICWS.2006.106";"ICWS";0
1804;"Resilient Trust Management for Web Service Integration.";"499-506";2005;"2015-08-20";"http://doi.ieeecomputersociety.org/10.1109/ICWS.2005.99";"ICWS";0
1805;"A Model to support SPKI Federations management through XKMS.";"338-345";2007;"2015-08-20";"http://doi.ieeecomputersociety.org/10.1109/ICWS.2007.8";"ICWS";0
1806;"Contract-First Design Techniques for Building Enterprise Web Services.";"591-598";2009;"2015-08-20";"http://doi.ieeecomputersociety.org/10.1109/ICWS.2009.91";"ICWS";0
1807;"WS-HFS: A Heterogeneous Feature Selection Framework for Web Services Mining.";"193-200";2015;"2015-08-19";"http://dx.doi.org/10.1109/ICWS.2015.35";"ICWS";0
1808;"Detecting Data Inconsistency Failure of Composite Web Services Through Parametric Stateful Aspect.";"68-75";2010;"2015-08-20";"http://doi.ieeecomputersociety.org/10.1109/ICWS.2010.29";"ICWS";0
1809;"Developing Process Mediator for Web Service Interactions.";"828-829";2008;"2015-08-20";"http://doi.ieeecomputersociety.org/10.1109/ICWS.2008.126";"ICWS";0
1810;"Delay-Aware Cost Optimization for Dynamic Resource Provisioning in Hybrid Clouds.";"169-176";2014;"2015-08-20";"http://doi.ieeecomputersociety.org/10.1109/ICWS.2014.35";"ICWS";0
1811;"BPIMS-WS: A Service-Oriented Architecture for Trading Partners Integration.";"789-790";2005;"2015-08-20";"http://doi.ieeecomputersociety.org/10.1109/ICWS.2005.32";"ICWS";0
1812;"Testing Optimization in Service EcoSystems (TEOS).";"650-651";2012;"2015-08-20";"http://doi.ieeecomputersociety.org/10.1109/ICWS.2012.80";"ICWS";0
1813;"Facing Uncertainty in Web Service Compositions.";"219-226";2013;"2015-08-20";"http://doi.ieeecomputersociety.org/10.1109/ICWS.2013.38";"ICWS";0
1814;"Privacy Preserving Personalized Access Control Service at Third Service Provider.";"694-695";2011;"2015-08-20";"http://doi.ieeecomputersociety.org/10.1109/ICWS.2011.46";"ICWS";0
1815;"A QoS-Oriented Reconfigurable Middleware for Self-Healing Web Services.";"104-111";2008;"2015-08-20";"http://doi.ieeecomputersociety.org/10.1109/ICWS.2008.113";"ICWS";0
1816;"Optimizing Web Services Performance by Differential Deserialization.";"185-192";2005;"2015-08-20";"http://doi.ieeecomputersociety.org/10.1109/ICWS.2005.87";"ICWS";0
1817;"Toward UML Profiles for Web Services and their Extra-Functional Properties.";"889-892";2006;"2015-08-20";"http://doi.ieeecomputersociety.org/10.1109/ICWS.2006.130";"ICWS";0
1818;"An Approach to Non-functional Property Evaluation of Web Services.";"1004-1005";2009;"2015-08-20";"http://doi.ieeecomputersociety.org/10.1109/ICWS.2009.147";"ICWS";0
1819;"Perspectives on Service-Oriented Architecture.";"not available";2005;"2015-08-20";"http://doi.ieeecomputersociety.org/10.1109/ICWS.2005.92";"ICWS";0
1820;"Towards Autonomous Service Composition in A Grid Environment.";"550-557";2004;"2015-08-20";"http://doi.ieeecomputersociety.org/10.1109/ICWS.2004.1314781";"ICWS";0
1821;"Towards automatic mediation of OWL-S process models.";"1032-1039";2007;"2015-08-20";"http://doi.ieeecomputersociety.org/10.1109/ICWS.2007.177";"ICWS";0
1822;"A CP-nets-based Design and Verification Framework for Web Services Composition.";"756-760";2004;"2015-08-20";"http://doi.ieeecomputersociety.org/10.1109/ICWS.2004.1314810";"ICWS";0
1823;"CredEx: User-Centric Credential Management for Grid and Web Services.";"149-156";2005;"2015-08-20";"http://doi.ieeecomputersociety.org/10.1109/ICWS.2005.43";"ICWS";0
1824;"Data-Dependency Aware Trust Evaluation for Service Choreography.";"708-709";2011;"2015-08-20";"http://doi.ieeecomputersociety.org/10.1109/ICWS.2011.57";"ICWS";0
1825;"Towards Automatic Tagging for Web Services.";"528-535";2012;"2015-08-20";"http://doi.ieeecomputersociety.org/10.1109/ICWS.2012.99";"ICWS";0
1826;"A Low-Cost Security Certification Scheme for Evolving Services.";"122-129";2012;"2015-08-20";"http://doi.ieeecomputersociety.org/10.1109/ICWS.2012.53";"ICWS";0
1827;"Coding-Free Model-Driven Enablement Framework and Engineering Practices of a Context-Aware SOA Modeling Environment.";"553-560";2008;"2015-08-20";"http://doi.ieeecomputersociety.org/10.1109/ICWS.2008.77";"ICWS";0
1828;"A Universal Service Description Language.";"823-824";2005;"2015-08-20";"http://doi.ieeecomputersociety.org/10.1109/ICWS.2005.20";"ICWS";0
1829;"WSOL - A Language for the Formal Specification of Classes of Service for Web Services.";"375-381";2003;"2003-10-17";" ";"ICWS";0
1830;"Analyzing the Relationships between some Parameters of Web Services Reputation.";"329-336";2010;"2015-08-20";"http://doi.ieeecomputersociety.org/10.1109/ICWS.2010.88";"ICWS";0
1831;"Efficient Service Data Management in Dynamic Environment.";"1040-1047";2007;"2015-08-20";"http://doi.ieeecomputersociety.org/10.1109/ICWS.2007.82";"ICWS";0
1832;"Message from the Program Chairs.";"not available";2006;"2015-08-20";"http://doi.ieeecomputersociety.org/10.1109/ICWS.2006.90";"ICWS";0
1833;"Automatic Sampling of Web Services.";"291-298";2011;"2015-08-20";"http://doi.ieeecomputersociety.org/10.1109/ICWS.2011.67";"ICWS";0
1834;"A Privacy-Preserving QoS Prediction Framework for Web Service Recommendation.";"241-248";2015;"2015-08-19";"http://dx.doi.org/10.1109/ICWS.2015.41";"ICWS";0
1835;"Variable Granularity Index on Massive Service Processes.";"18-25";2013;"2015-08-20";"http://doi.ieeecomputersociety.org/10.1109/ICWS.2013.13";"ICWS";0
1836;"Hyperdatabases for Peer-to-Peer Data Stream Processing.";"358-";2004;"2015-08-20";"http://doi.ieeecomputersociety.org/10.1109/ICWS.2004.1314758";"ICWS";0
1837;"A Framework for Building Reliable Distributed Bioinformatics Service Repositories.";"1018-1019";2009;"2015-08-20";"http://doi.ieeecomputersociety.org/10.1109/ICWS.2009.143";"ICWS";0
1838;"Reliability Analysis of Component-Based Software Based on Relationships of Components.";"814-815";2008;"2015-08-20";"http://doi.ieeecomputersociety.org/10.1109/ICWS.2008.83";"ICWS";0
1839;"Autonomic Execution of Web Service Compositions.";"435-442";2005;"2015-08-20";"http://doi.ieeecomputersociety.org/10.1109/ICWS.2005.28";"ICWS";0
1840;"Toward Exposing and Accessing HPC Applications in a SaaS Cloud.";"692-699";2012;"2015-08-20";"http://doi.ieeecomputersociety.org/10.1109/ICWS.2012.119";"ICWS";0
1841;"Specification of Invocable Semantic Web Resources.";"124-";2004;"2015-08-20";"http://doi.ieeecomputersociety.org/10.1109/ICWS.2004.1314731";"ICWS";0
1842;"Defending Web Services against Denial of Service Attacks Using Client Puzzles.";"25-32";2011;"2015-08-20";"http://doi.ieeecomputersociety.org/10.1109/ICWS.2011.22";"ICWS";0
1843;"On Demand Network and Application Provisioning ThroughWeb Services.";"1120-1127";2007;"2015-08-20";"http://doi.ieeecomputersociety.org/10.1109/ICWS.2007.135";"ICWS";0
1844;"Session Management for Cross-protocol Identity Federation.";"1150-1151";2007;"2015-08-20";"http://doi.ieeecomputersociety.org/10.1109/ICWS.2007.165";"ICWS";0
1845;"Declarative Constraint Framework for SOA Deployment and Configuration.";"637-644";2008;"2015-08-20";"http://doi.ieeecomputersociety.org/10.1109/ICWS.2008.33";"ICWS";0
1846;"Practical SOA: Service Modeling, Enterprise Service Bus and Governance.";"11";2008;"2015-08-20";"http://doi.ieeecomputersociety.org/10.1109/ICWS.2008.148";"ICWS";0
1847;"A Modeling Approach for Service-Oriented Application Based on Extensive Reuse.";"754-757";2008;"2015-08-20";"http://doi.ieeecomputersociety.org/10.1109/ICWS.2008.95";"ICWS";0
1848;"goDiscovery: Web Service Discovery Made Efficient.";"711-716";2015;"2015-08-19";"http://dx.doi.org/10.1109/ICWS.2015.99";"ICWS";0
1849;"Location Analytics as a Service: Providing Insights for Heterogeneous Spatiotemporal Data.";"353-360";2015;"2015-08-19";"http://dx.doi.org/10.1109/ICWS.2015.114";"ICWS";0
1850;"Adding Semantics to Web Services Standards.";"395-401";2003;"2003-10-17";" ";"ICWS";0
1851;"Trust Assessment for Web Services Collaboration.";"315-320";2010;"2015-08-20";"http://doi.ieeecomputersociety.org/10.1109/ICWS.2010.99";"ICWS";0
1852;"Web Services versus Distributed Objects: A Case Study of Performance and Interface Design.";"419-426";2006;"2015-08-20";"http://doi.ieeecomputersociety.org/10.1109/ICWS.2006.145";"ICWS";0
1853;"Collaborative Web Service QoS Prediction on Unbalanced Data Distribution.";"377-384";2014;"2015-08-20";"http://doi.ieeecomputersociety.org/10.1109/ICWS.2014.61";"ICWS";0
1854;"A Context-Aware Trust-Oriented Influencers Finding in Online Social Networks.";"456-463";2015;"2015-08-19";"http://dx.doi.org/10.1109/ICWS.2015.67";"ICWS";0
1855;"jGASW: A Service-Oriented Framework Supporting HTC and Non-functional Concerns.";"691-694";2010;"2015-08-20";"http://doi.ieeecomputersociety.org/10.1109/ICWS.2010.59";"ICWS";0
1856;"Event-Based Multi-level Service Monitoring.";"83-90";2013;"2015-08-20";"http://doi.ieeecomputersociety.org/10.1109/ICWS.2013.21";"ICWS";0
1857;"Best-Practice Patterns and Tool Support for Configuring Secure Web Services Messaging.";"244-251";2004;"2015-08-20";"http://doi.ieeecomputersociety.org/10.1109/ICWS.2004.1314745";"ICWS";0
1858;"Service Evolution Management Based on Usage Profile.";"746-747";2011;"2015-08-20";"http://doi.ieeecomputersociety.org/10.1109/ICWS.2011.102";"ICWS";0
1859;"Autonomic Web Service Platform with Dynamic Multi-Layer Control.";"414-421";2007;"2015-08-20";"http://doi.ieeecomputersociety.org/10.1109/ICWS.2007.56";"ICWS";0
1860;"A Collaborative Approach to Predicting Service Price for QoS-Aware Service Selection.";"33-40";2015;"2015-08-19";"http://dx.doi.org/10.1109/ICWS.2015.15";"ICWS";0
1861;"A Version-aware Approach for Web Service Directory.";"406-413";2007;"2015-08-20";"http://doi.ieeecomputersociety.org/10.1109/ICWS.2007.26";"ICWS";0
1862;"Scaling Spatial Alarm Services on Road Networks.";"98-105";2012;"2015-08-20";"http://doi.ieeecomputersociety.org/10.1109/ICWS.2012.93";"ICWS";0
1863;"Adaptive Workflow Management with Open Kernel Framework Based on Web Services.";"124-130";2003;"2003-10-17";" ";"ICWS";0
1864;"2012 IEEE 19th International Conference on Web Services, Honolulu, HI, USA, June 24-29, 2012";"not available";2012;"2015-08-19";"http://www.computer.org/csdl/proceedings/icws/2012/2131/00/index.html";"ICWS";0
1865;"Virtualised Trusted Computing Platform for Adaptive Security Enforcement of Web Services Interactions.";"615-622";2007;"2015-08-20";"http://doi.ieeecomputersociety.org/10.1109/ICWS.2007.188";"ICWS";0
1866;"On Recommendation of Process Mining Algorithms.";"311-318";2012;"2015-08-20";"http://doi.ieeecomputersociety.org/10.1109/ICWS.2012.52";"ICWS";0
1867;"Large Scale, Type-Compatible Service Composition.";"506-513";2004;"2015-08-20";"http://doi.ieeecomputersociety.org/10.1109/ICWS.2004.1314776";"ICWS";0
1868;"SOAP-based Secure Conversation and Collaboration.";"471-480";2007;"2015-08-20";"http://doi.ieeecomputersociety.org/10.1109/ICWS.2007.167";"ICWS";0
1869;"Combining Global and Local Trust for Service Recommendation.";"305-312";2014;"2015-08-20";"http://doi.ieeecomputersociety.org/10.1109/ICWS.2014.52";"ICWS";0
1870;"WSExpress: A QoS-aware Search Engine for Web Services.";"91-98";2010;"2015-08-20";"http://doi.ieeecomputersociety.org/10.1109/ICWS.2010.20";"ICWS";0
1871;"Performance Evaluation and Modeling of Web Services Security.";"431-438";2007;"2015-08-20";"http://doi.ieeecomputersociety.org/10.1109/ICWS.2007.139";"ICWS";0
1872;"Estimating the Cost of Developing Customizations to Packaged Application Software Using Service Oriented Architecture.";"433-440";2010;"2015-08-20";"http://doi.ieeecomputersociety.org/10.1109/ICWS.2010.94";"ICWS";0
1873;"Behavior Descriptions of Mobile Agents for Web Services Integration.";"342-349";2004;"2015-08-20";"http://doi.ieeecomputersociety.org/10.1109/ICWS.2004.1314756";"ICWS";0
1874;"Modeling Accountable Cloud Services.";"353-360";2014;"2015-08-20";"http://doi.ieeecomputersociety.org/10.1109/ICWS.2014.58";"ICWS";0
1875;"ITWS: An Extensible Tool for Interoperability Testing of Web Services.";"409-416";2014;"2015-08-20";"http://doi.ieeecomputersociety.org/10.1109/ICWS.2014.65";"ICWS";0
1876;"MASC - .NET-Based Middleware for Adaptive Composite Web Services.";"727-734";2007;"2015-08-20";"http://doi.ieeecomputersociety.org/10.1109/ICWS.2007.116";"ICWS";0
1877;"Augmenting Web Services Composition with Transactional Requirements.";"91-98";2006;"2015-08-20";"http://doi.ieeecomputersociety.org/10.1109/ICWS.2006.32";"ICWS";0
1878;"WS-Policy: On Conditional and Custom Assertions.";"936-943";2009;"2015-08-20";"http://doi.ieeecomputersociety.org/10.1109/ICWS.2009.73";"ICWS";0
1879;"S-ABC - A Service-Oriented Artificial Bee Colony Algorithm for Global Optimal Services Selection in Concurrent Requests Environment.";"503-509";2014;"2015-08-26";"http://doi.ieeecomputersociety.org/10.1109/ICWS.2014.77";"ICWS";0
1880;"A Learning Ontology Method for RESTful Semantic Web Services.";"251-258";2011;"2015-08-20";"http://doi.ieeecomputersociety.org/10.1109/ICWS.2011.59";"ICWS";0
1881;"A Dependable Infrastructure for Cooperative Web Services Coordination.";"21-28";2008;"2015-08-20";"http://doi.ieeecomputersociety.org/10.1109/ICWS.2008.54";"ICWS";0
1882;"Dodai-Deploy: Fast Cluster Deployment Tool.";"681-682";2012;"2015-08-20";"http://doi.ieeecomputersociety.org/10.1109/ICWS.2012.71";"ICWS";0
1883;"Control Flow Requirements for Automated Service Composition.";"17-24";2009;"2015-08-20";"http://doi.ieeecomputersociety.org/10.1109/ICWS.2009.31";"ICWS";0
1884;"Extending the Web Services Model to IT Services.";"824-";2004;"2015-08-20";"http://doi.ieeecomputersociety.org/10.1109/ICWS.2004.1314960";"ICWS";0
1885;"A Study of Caching Strategies for Web Service Discovery.";"464-471";2015;"2015-08-19";"http://dx.doi.org/10.1109/ICWS.2015.68";"ICWS";0
1886;"Process Mining, Discovery, and Integration using Distance Measures.";"479-488";2006;"2015-08-20";"http://doi.ieeecomputersociety.org/10.1109/ICWS.2006.105";"ICWS";0
1887;"Service HyperChain Architecture of Web X.o and A Case Study.";"968-975";2007;"2015-08-20";"http://doi.ieeecomputersociety.org/10.1109/ICWS.2007.159";"ICWS";0
1888;"Differential SOAP Multicasting.";"1-8";2011;"2015-08-20";"http://doi.ieeecomputersociety.org/10.1109/ICWS.2011.51";"ICWS";0
1889;"Experiences with Service Computing--A View from the Business World.";"not available";2005;"2015-08-20";"http://doi.ieeecomputersociety.org/10.1109/ICWS.2005.58";"ICWS";0
1890;"SOAP Optimization via Client Side Caching.";"520-";2003;"2003-10-17";" ";"ICWS";0
1891;"Parallel Computing Framework as a Cloud Service.";"672-673";2012;"2015-08-20";"http://doi.ieeecomputersociety.org/10.1109/ICWS.2012.55";"ICWS";0
1892;"An Approach of QoS-Guaranteed Web Service Composition Based on a Win-Win Strategy.";"628-630";2012;"2015-08-20";"http://doi.ieeecomputersociety.org/10.1109/ICWS.2012.28";"ICWS";0
1893;"Web Services Enabled E-Market Access Control (EMAC).";"69-75";2003;"2003-10-17";" ";"ICWS";0
1894;"AutomaticWorkflows Composition of Mobile Services.";"823-830";2007;"2015-08-20";"http://doi.ieeecomputersociety.org/10.1109/ICWS.2007.55";"ICWS";0
1895;"Dynamic Adaptation of Fragment-Based and Context-Aware Business Processes.";"33-41";2012;"2015-08-20";"http://doi.ieeecomputersociety.org/10.1109/ICWS.2012.56";"ICWS";0
1896;"M2M Interface: A Web Services-based Framework for Federated Enterprise Management.";"767-774";2005;"2015-08-20";"http://doi.ieeecomputersociety.org/10.1109/ICWS.2005.72";"ICWS";0
1897;"A Declarative Approach to Enhancing the Reliability of BPEL Processes.";"272-279";2007;"2015-08-20";"http://doi.ieeecomputersociety.org/10.1109/ICWS.2007.1";"ICWS";0
1898;"Reducing User Perceived Latency in Mobile Processes.";"235-242";2010;"2015-08-20";"http://doi.ieeecomputersociety.org/10.1109/ICWS.2010.12";"ICWS";0
1899;"Supporting Adaptive Web-Service Orchestration with an Agent Conversation Framework.";"541-549";2005;"2015-08-20";"http://doi.ieeecomputersociety.org/10.1109/ICWS.2005.116";"ICWS";0
1900;"IEEE Computer Society Technical Committee on Services Computing.";"not available";2006;"2015-08-20";"http://doi.ieeecomputersociety.org/10.1109/ICWS.2006.71";"ICWS";0
1901;"Automatic Propagation of User Inputs in Service Composition for End-Users.";"73-80";2014;"2015-08-20";"http://doi.ieeecomputersociety.org/10.1109/ICWS.2014.23";"ICWS";0
1902;"A Multi-Level Model for Web Service Composition.";"462-";2004;"2015-08-20";"http://doi.ieeecomputersociety.org/10.1109/ICWS.2004.1314771";"ICWS";0
1903;"Flow-Based Service Selection forWeb Service Composition Supporting Multiple QoS Classes.";"743-750";2007;"2015-08-20";"http://doi.ieeecomputersociety.org/10.1109/ICWS.2007.91";"ICWS";0
1904;"Support Web Services Composition with Optimal Cost Using PPA.";"760-761";2008;"2015-08-20";"http://doi.ieeecomputersociety.org/10.1109/ICWS.2008.50";"ICWS";0
1905;"A Cooperative and Adaptive System for Caching Web Service Responses in MANETs.";"339-346";2006;"2015-08-20";"http://doi.ieeecomputersociety.org/10.1109/ICWS.2006.1";"ICWS";0
1906;"Annotating Web Service Sections with Combined Classification.";"622-629";2014;"2015-08-20";"http://doi.ieeecomputersociety.org/10.1109/ICWS.2014.92";"ICWS";0
1907;"STaaS: Spatio Temporal Historian as a Service.";"747-750";2015;"2015-08-19";"http://dx.doi.org/10.1109/ICWS.2015.107";"ICWS";0
1908;"Net-Enabled Applications for Commercial Aviation.";"2";2008;"2015-08-20";"http://doi.ieeecomputersociety.org/10.1109/ICWS.2008.141";"ICWS";0
1909;"Proactive Service Discovery and Execution Using Agents.";"463-470";2006;"2015-08-20";"http://doi.ieeecomputersociety.org/10.1109/ICWS.2006.103";"ICWS";0
1910;"Workload-aware Business Process Simulation with Statistical Service Analysis and Timed Petri Net.";"70-77";2007;"2015-08-20";"http://doi.ieeecomputersociety.org/10.1109/ICWS.2007.195";"ICWS";0
1911;"Message from the IEEE ICWS/SCC/SERVICES 2007 Plenary Panel Program Co-Chairs.";"not available";2007;"2015-08-20";"http://doi.ieeecomputersociety.org/10.1109/ICWS.2007.119";"ICWS";0
1912;"Automatic Message Flow Analyses for Web Services Based on WSDL.";"880-887";2007;"2015-08-20";"http://doi.ieeecomputersociety.org/10.1109/ICWS.2007.53";"ICWS";0
1913;"Reusable Functional Composition Patterns for Web Services.";"498-505";2004;"2015-08-20";"http://doi.ieeecomputersociety.org/10.1109/ICWS.2004.1314775";"ICWS";0
1914;"A Generic Cost Model and Infrastructure for Improving Web Service Efficiency through Dynamic Relocation.";"381-388";2005;"2015-08-20";"http://doi.ieeecomputersociety.org/10.1109/ICWS.2005.5";"ICWS";0
1915;"Self-Reconfiguration of Service-Based Systems: A Case Study for Service Level Agreements and Resource Optimization.";"266-273";2005;"2015-08-20";"http://doi.ieeecomputersociety.org/10.1109/ICWS.2005.103";"ICWS";0
1916;"Web Services Discovery Based on Latent Semantic Approach.";"740-747";2008;"2015-08-20";"http://doi.ieeecomputersociety.org/10.1109/ICWS.2008.135";"ICWS";0
1917;"MACE: A Dynamic Caching Framework for Mashups.";"75-82";2009;"2015-08-20";"http://doi.ieeecomputersociety.org/10.1109/ICWS.2009.119";"ICWS";0
1918;"Towards Optimal and Scalable Non-functional Service Matchmaking Techniques.";"327-335";2012;"2015-08-20";"http://doi.ieeecomputersociety.org/10.1109/ICWS.2012.27";"ICWS";0
1919;"An Efficient Syntactic Web Service Composition Algorithm Based on the Planning Graph Model.";"691-699";2008;"2015-08-20";"http://doi.ieeecomputersociety.org/10.1109/ICWS.2008.134";"ICWS";0
1920;"Design and Verification ofWeb Services Compositions in the Telecommunication Domain.";"1214-1215";2007;"2015-08-20";"http://doi.ieeecomputersociety.org/10.1109/ICWS.2007.75";"ICWS";0
1921;"QoS Aware Semantic Web Service Composition Approach Considering Pre/Postconditions.";"345-352";2010;"2015-08-20";"http://doi.ieeecomputersociety.org/10.1109/ICWS.2010.90";"ICWS";0
1922;"Automatic Web Service Composition Based on Logical Inference of Horn Clauses in Petri Net Models.";"1162-1163";2007;"2015-08-20";"http://doi.ieeecomputersociety.org/10.1109/ICWS.2007.54";"ICWS";0
1923;"The Design and Implementation of An OGSA-based Grid Information Service.";"566-";2004;"2015-08-20";"http://doi.ieeecomputersociety.org/10.1109/ICWS.2004.1314783";"ICWS";0
1924;"Opportunistic Composition of Sequentially-Connected Services in Mobile Computing Environments.";"17-24";2011;"2015-08-20";"http://doi.ieeecomputersociety.org/10.1109/ICWS.2011.56";"ICWS";0
1925;"A Flexible and Efficient Approach to Reconcile Different Web Services-based Event Notification Specifications.";"735-742";2006;"2015-08-20";"http://doi.ieeecomputersociety.org/10.1109/ICWS.2006.2";"ICWS";0
1926;"IEEE International Conference on Web Services, ICWS 2011, Washington, DC, USA, July 4-9, 2011";"not available";2011;"2015-08-19";"http://www.computer.org/csdl/proceedings/icws/2011/0842/00/index.html";"ICWS";0
1927;"Exploiting Metrics for Similarity-Based Semantic Web Service Discovery.";"327-334";2009;"2015-08-20";"http://doi.ieeecomputersociety.org/10.1109/ICWS.2009.26";"ICWS";0
1928;"Emergency Response Framework for Aviation XML Services on MANET.";"304-311";2008;"2015-08-20";"http://doi.ieeecomputersociety.org/10.1109/ICWS.2008.24";"ICWS";0
1929;"Web Services Mobility in a Pocket.";"159-166";2005;"2015-08-20";"http://doi.ieeecomputersociety.org/10.1109/ICWS.2005.134";"ICWS";0
1930;"Realizability of Conversation Protocols With Message Contents.";"96-";2004;"2015-08-20";"http://doi.ieeecomputersociety.org/10.1109/ICWS.2004.1314728";"ICWS";0
1931;"CoWS: An Internet-Enriched and Quality-Aware Web Services Search Engine.";"419-427";2011;"2015-08-20";"http://doi.ieeecomputersociety.org/10.1109/ICWS.2011.49";"ICWS";0
1932;"ServiceJ A Java Extension for ProgrammingWeb Services Interactions.";"505-512";2007;"2015-08-20";"http://doi.ieeecomputersociety.org/10.1109/ICWS.2007.161";"ICWS";0
1933;"A Comprehensive Six-Dimensional Quality of Web Services Assessment Model.";"822-823";2008;"2015-08-20";"http://doi.ieeecomputersociety.org/10.1109/ICWS.2008.81";"ICWS";0
1934;"Shared Data Services: An Architectural Approach.";"683-690";2005;"2015-08-20";"http://doi.ieeecomputersociety.org/10.1109/ICWS.2005.112";"ICWS";0
1935;"Service Evolution Patterns.";"201-208";2014;"2015-08-20";"http://doi.ieeecomputersociety.org/10.1109/ICWS.2014.39";"ICWS";0
