"id";"title";"pages";"year";"date";"url";"conference_name";"count"
2705;"An Extensible Abstract Service Orchestration Framework.";"831-838";2009;"2015-08-20";"http://doi.ieeecomputersociety.org/10.1109/ICWS.2009.14";"ICWS";0
2706;"SAWSDL-MX2: A Machine-Learning Approach for Integrating Semantic Web Service Matchmaking Variants.";"335-342";2009;"2015-08-20";"http://doi.ieeecomputersociety.org/10.1109/ICWS.2009.76";"ICWS";0
2707;"A Distributed Planning Approach for Web Services Composition.";"337-344";2010;"2015-08-20";"http://doi.ieeecomputersociety.org/10.1109/ICWS.2010.13";"ICWS";0
2708;"Ontology-Based Test Modeling and Partition Testing of Web Services.";"465-472";2008;"2015-08-20";"http://doi.ieeecomputersociety.org/10.1109/ICWS.2008.111";"ICWS";0
2709;"Apto: A MDD-Based Generic Framework for Context-Aware Deeply Adaptive Service-Based Processes.";"219-226";2010;"2015-08-20";"http://doi.ieeecomputersociety.org/10.1109/ICWS.2010.16";"ICWS";0
2710;"A Small Listener for Heterogeneous Mobile Devices: A Service Enabler with a Uniform Web Object View.";"733-740";2005;"2015-08-20";"http://doi.ieeecomputersociety.org/10.1109/ICWS.2005.18";"ICWS";0
2711;"A Maximal Common Subgraph Based Method for Process Retrieval.";"316-323";2013;"2015-08-20";"http://doi.ieeecomputersociety.org/10.1109/ICWS.2013.50";"ICWS";0
2712;"Alert-Driven Process Integration in a Web Services Environment.";"145-151";2003;"2003-10-17";" ";"ICWS";0
2713;"Bridging Trust Relationships with Web Service Enhancements.";"163-169";2006;"2015-08-20";"http://doi.ieeecomputersociety.org/10.1109/ICWS.2006.40";"ICWS";0
2714;"Designing Web Services with Tropos.";"306-";2004;"2015-08-20";"http://doi.ieeecomputersociety.org/10.1109/ICWS.2004.1314752";"ICWS";0
2715;"Establishing and Monitoring SLAs in Complex Service Based Systems.";"783-790";2009;"2015-08-20";"http://doi.ieeecomputersociety.org/10.1109/ICWS.2009.47";"ICWS";0
2716;"An Approach to Composing Web Services with Context Heterogeneity.";"695-702";2009;"2015-08-20";"http://doi.ieeecomputersociety.org/10.1109/ICWS.2009.37";"ICWS";0
2717;"Describing and Verifying Integrity Constraints in XML Using OCL.";"657-658";2012;"2015-08-20";"http://doi.ieeecomputersociety.org/10.1109/ICWS.2012.60";"ICWS";0
2718;"An Approach to Exception Handling for Service-Oriented Systems.";"727-734";2006;"2015-08-20";"http://doi.ieeecomputersociety.org/10.1109/ICWS.2006.28";"ICWS";0
2719;"A-SOAP: Adaptive SOAP Message Processing and Compression.";"200-207";2007;"2015-08-20";"http://doi.ieeecomputersociety.org/10.1109/ICWS.2007.29";"ICWS";0
2720;"An Architecture for Decentralised Orchestration of Web Service Workflows.";"603-604";2013;"2015-08-20";"http://doi.ieeecomputersociety.org/10.1109/ICWS.2013.84";"ICWS";0
2721;"A Web 2.0-Based Scientific Application Framework.";"642-643";2010;"2015-08-20";"http://doi.ieeecomputersociety.org/10.1109/ICWS.2010.107";"ICWS";0
2722;"QoS Explorer: A Tool for Exploring QoS in Composed Services.";"797-806";2006;"2015-08-20";"http://doi.ieeecomputersociety.org/10.1109/ICWS.2006.108";"ICWS";0
2723;"Computing Service Skylines over Sets of Services.";"481-488";2010;"2015-08-20";"http://doi.ieeecomputersociety.org/10.1109/ICWS.2010.48";"ICWS";0
2724;"A Graph-Based Data Model for API Ecosystem Insights.";"41-48";2014;"2015-08-20";"http://doi.ieeecomputersociety.org/10.1109/ICWS.2014.19";"ICWS";0
2725;"Tutorial 4: Web Services on Rails: Using Ruby and Rails for Web Services Development and Mashups.";"not available";2006;"2015-08-20";"http://doi.ieeecomputersociety.org/10.1109/ICWS.2006.139";"ICWS";0
2726;"Composing Non-functional Concerns in Composite Web Services.";"331-338";2011;"2015-08-20";"http://doi.ieeecomputersociety.org/10.1109/ICWS.2011.111";"ICWS";0
2727;"Services Computing in Action: Services Architectures.";"not available";2007;"2015-08-20";"http://doi.ieeecomputersociety.org/10.1109/ICWS.2007.162";"ICWS";0
2728;"Web Services Technology and Learning Technology- A Web-Services Model for Constructing Decentralized Virtual Learning Environments.";"507-514";2003;"2003-10-17";" ";"ICWS";0
2729;"A Lightweight Framework forWeb Services Invocation over Bluetooth.";"331-338";2006;"2015-08-20";"http://doi.ieeecomputersociety.org/10.1109/ICWS.2006.7";"ICWS";0
2730;"A Peer-to-Peer Framework for Web Service Discovery with Ranking.";"192-199";2004;"2015-08-20";"http://doi.ieeecomputersociety.org/10.1109/ICWS.2004.1314739";"ICWS";0
2731;"Services Computing in Daily Work: Service Engineering vs. Software Engineering.";"not available";2007;"2015-08-20";"http://doi.ieeecomputersociety.org/10.1109/ICWS.2007.163";"ICWS";0
2732;"Web Services in Wireless Networks - What Happened to the Performance?";"278-284";2003;"2003-10-17";" ";"ICWS";0
2733;"Modeling and Diagnosing OrchestratedWeb Service Processes.";"51-59";2007;"2015-08-20";"http://doi.ieeecomputersociety.org/10.1109/ICWS.2007.124";"ICWS";0
2734;"Efficient Correlation-Aware Service Selection.";"1-8";2012;"2015-08-20";"http://doi.ieeecomputersociety.org/10.1109/ICWS.2012.62";"ICWS";0
2735;"Interoperability among Service Registry Implementations: Is UDDI Standard Enough?";"724-731";2008;"2015-08-20";"http://doi.ieeecomputersociety.org/10.1109/ICWS.2008.70";"ICWS";0
2736;"Parameter Tuning for ABC-Based Service Composition with End-to-End QoS Constraints.";"590-597";2014;"2015-08-20";"http://doi.ieeecomputersociety.org/10.1109/ICWS.2014.88";"ICWS";0
2737;"Rep4WS: A Paxos Based Replication Framework for Building Consistent and Reliable Web Services.";"295-302";2012;"2015-08-20";"http://doi.ieeecomputersociety.org/10.1109/ICWS.2012.48";"ICWS";0
2738;"HyperService: Linking and Exploring Services on the Web.";"17-24";2010;"2015-08-20";"http://doi.ieeecomputersociety.org/10.1109/ICWS.2010.11";"ICWS";0
2739;"2013 IEEE 20th International Conference on Web Services, Santa Clara, CA, USA, June 28 - July 3, 2013";"not available";2013;"2015-08-20";"http://www.computer.org/csdl/proceedings/icws/2013/5025/00/index.html";"ICWS";0
2740;"Services Research at IBM.";"not available";2007;"2015-08-20";"http://doi.ieeecomputersociety.org/10.1109/ICWS.2007.164";"ICWS";0
2741;"Dynamic Workflow Composition using Markov Decision Processes.";"576-582";2004;"2015-08-20";"http://doi.ieeecomputersociety.org/10.1109/ICWS.2004.1314784";"ICWS";0
2742;"Data-centric Web Services Based on Business Artifacts.";"42-49";2012;"2015-08-20";"http://doi.ieeecomputersociety.org/10.1109/ICWS.2012.101";"ICWS";0
2743;"Pruning Based Service Selection Approach Under QoS and Temporal Constraints.";"9-16";2014;"2015-08-20";"http://doi.ieeecomputersociety.org/10.1109/ICWS.2014.15";"ICWS";0
2744;"Netcoin: A Traceable P2P Electronic Cash System.";"472-478";2015;"2015-08-19";"http://dx.doi.org/10.1109/ICWS.2015.69";"ICWS";0
2745;"Reliability-Aware Energy Efficiency in Web Service Provision and Placement.";"411-418";2013;"2015-08-20";"http://doi.ieeecomputersociety.org/10.1109/ICWS.2013.62";"ICWS";0
2746;"Minimizing Waiting Time for Service Composition: A Frictional Approach.";"268-275";2013;"2015-08-20";"http://doi.ieeecomputersociety.org/10.1109/ICWS.2013.44";"ICWS";0
2747;"A Dynamic Data Structure for Geospatial Web Services Integration.";"800-";2004;"2015-08-20";"http://doi.ieeecomputersociety.org/10.1109/ICWS.2004.1314826";"ICWS";0
2748;"Performance Comparison of Web Service Engines in PHP, Java and C.";"385-392";2008;"2015-08-20";"http://doi.ieeecomputersociety.org/10.1109/ICWS.2008.71";"ICWS";0
2749;"A Feature-Oriented Approach for Web Service Customization.";"393-400";2010;"2015-08-20";"http://doi.ieeecomputersociety.org/10.1109/ICWS.2010.64";"ICWS";0
2750;"PEESOS: A Web Tool for Planning and Execution of Experiments in Service Oriented Systems.";"606-613";2014;"2015-08-20";"http://doi.ieeecomputersociety.org/10.1109/ICWS.2014.90";"ICWS";0
2751;"Adaptive Quality Recommendation Mechanism for Software Service Provisioning.";"169-176";2008;"2015-08-20";"http://doi.ieeecomputersociety.org/10.1109/ICWS.2008.120";"ICWS";0
2752;"On the Optimal Petri Net Representation for Service Composition.";"235-242";2011;"2015-08-20";"http://doi.ieeecomputersociety.org/10.1109/ICWS.2011.40";"ICWS";0
2753;"A Feedback Control Framework of Service Composition Execution for Response Time Guarantee.";"1158-1159";2007;"2015-08-20";"http://doi.ieeecomputersociety.org/10.1109/ICWS.2007.3";"ICWS";0
2754;"Web Service Integration Platform with Privacy Preferences for One-Stop Application.";"227-230";2003;"2003-10-17";" ";"ICWS";0
2755;"Two-Way Web Service: From Interface Design to Interface Verification.";"525-532";2005;"2015-08-20";"http://doi.ieeecomputersociety.org/10.1109/ICWS.2005.124";"ICWS";0
2756;"Context-Aware Service Composition and Component Change-over using Semantic Web Techniques.";"687-694";2007;"2015-08-20";"http://doi.ieeecomputersociety.org/10.1109/ICWS.2007.67";"ICWS";0
2757;"Towards Verifying Contract Regulated Service Composition.";"254-261";2008;"2015-08-20";"http://doi.ieeecomputersociety.org/10.1109/ICWS.2008.115";"ICWS";0
2758;"Semantic and Syntactic Data Flow in Web Service Composition.";"211-218";2008;"2015-08-20";"http://doi.ieeecomputersociety.org/10.1109/ICWS.2008.96";"ICWS";0
2759;"Inferring Behavioural Models from Traces of Business Applications.";"791-798";2009;"2015-08-20";"http://doi.ieeecomputersociety.org/10.1109/ICWS.2009.114";"ICWS";0
2760;"An Efficient Resource Allocation Approach Based on a Genetic Algorithm for Composite Services in IoT Environments.";"543-550";2015;"2015-08-19";"http://dx.doi.org/10.1109/ICWS.2015.78";"ICWS";0
2761;"Efficient and Secure Search of Enterprise File Systems.";"18-25";2007;"2015-08-20";"http://doi.ieeecomputersociety.org/10.1109/ICWS.2007.80";"ICWS";0
2762;"Net Traveler: A Framework for Autonomic Web Services Collaboration, Orchestration and Choreography in E-Government Information Systems.";"2-10";2004;"2015-08-20";"http://doi.ieeecomputersociety.org/10.1109/ICWS.2004.1314717";"ICWS";0
2763;"Formal Methods for Data-centric Web Services: From Model to Implementation.";"332-339";2013;"2015-08-20";"http://doi.ieeecomputersociety.org/10.1109/ICWS.2013.52";"ICWS";0
2764;"Constructing Operation-Level Ontologies for Web Services.";"716-717";2011;"2015-08-20";"http://doi.ieeecomputersociety.org/10.1109/ICWS.2011.107";"ICWS";0
2765;"Compatibility and Reparation of Web Service Processes.";"634-637";2010;"2015-08-20";"http://doi.ieeecomputersociety.org/10.1109/ICWS.2010.41";"ICWS";0
2766;"Modelling Inter-organizational Workflow Security in a Peer-to-Peer Environment.";"533-540";2005;"2015-08-20";"http://doi.ieeecomputersociety.org/10.1109/ICWS.2005.83";"ICWS";0
2767;"Change Sequence Mining for Context Aware Service Process Customization.";"777-778";2008;"2015-08-20";"http://doi.ieeecomputersociety.org/10.1109/ICWS.2008.67";"ICWS";0
2768;"A Utility-Aware Runtime Conflict Resolver for Composite Web Services.";"682-683";2014;"2015-08-20";"http://doi.ieeecomputersociety.org/10.1109/ICWS.2014.101";"ICWS";0
2769;"A Framework for Collecting Provenance in Data-Centric Scientific Workflows.";"427-436";2006;"2015-08-20";"http://doi.ieeecomputersociety.org/10.1109/ICWS.2006.5";"ICWS";0
2770;"WSRec: A Collaborative Filtering Based Web Service Recommender System.";"437-444";2009;"2015-08-20";"http://doi.ieeecomputersociety.org/10.1109/ICWS.2009.30";"ICWS";0
2771;"Describing and Reasoning on Web Services using Process Algebra.";"43-";2004;"2015-08-20";"http://doi.ieeecomputersociety.org/10.1109/ICWS.2004.1314722";"ICWS";0
2772;"Integrating Discovery and Automated Composition: from Semantic Requirements to Executable Code.";"815-822";2007;"2015-08-20";"http://doi.ieeecomputersociety.org/10.1109/ICWS.2007.111";"ICWS";0
2773;"K-Anonymity Based Approach for Privacy-Preserving Web Service Selection.";"281-288";2015;"2015-08-19";"http://dx.doi.org/10.1109/ICWS.2015.46";"ICWS";0
2774;"An Approach for Parallel Execution of Web Services.";"812-813";2004;"2015-08-20";"http://doi.ieeecomputersociety.org/10.1109/ICWS.2004.1314831";"ICWS";0
2775;"Personalizing Access to Semantic Web Services.";"259-266";2011;"2015-08-20";"http://doi.ieeecomputersociety.org/10.1109/ICWS.2011.9";"ICWS";0
2776;"Deriving Transactional Properties of CompositeWeb Services.";"631-638";2007;"2015-08-20";"http://doi.ieeecomputersociety.org/10.1109/ICWS.2007.72";"ICWS";0
2777;"TARGET: Two-way Web Service Router Gateway.";"629-636";2006;"2015-08-20";"http://doi.ieeecomputersociety.org/10.1109/ICWS.2006.127";"ICWS";0
2778;"Using Model Customization for Variability Management in Service Compositions.";"687-694";2009;"2015-08-20";"http://doi.ieeecomputersociety.org/10.1109/ICWS.2009.92";"ICWS";0
2779;"Extracting, Ranking, and Evaluating Quality Features of Web Services through User Review Sentiment Analysis.";"153-160";2015;"2015-10-15";"http://dx.doi.org/10.1109/ICWS.2015.30";"ICWS";0
2780;"MWS-MCS: A Novel Multi-agent-assisted and WS-Management-based Composite Service Management Scheme.";"1041-1042";2009;"2015-08-20";"http://doi.ieeecomputersociety.org/10.1109/ICWS.2009.146";"ICWS";0
2781;"Policy Lifecycle and Policy Enabled Telecom Open Service Delivery Platform.";"613-620";2005;"2015-08-20";"http://doi.ieeecomputersociety.org/10.1109/ICWS.2005.93";"ICWS";0
2782;"Developing e-Negotiation Process Support by Web Services.";"97-103";2003;"2003-10-17";" ";"ICWS";0
2783;"Flexible Execution of Adaptable Composed Services.";"369-376";2014;"2015-08-20";"http://doi.ieeecomputersociety.org/10.1109/ICWS.2014.60";"ICWS";0
2784;"ReliableWeb Services: Methodology, Experiment and Modeling.";"679-686";2007;"2015-08-20";"http://doi.ieeecomputersociety.org/10.1109/ICWS.2007.151";"ICWS";0
2785;"Optimal and Effective Web Service Composition with Trust and User Preference.";"329-336";2015;"2015-08-19";"http://dx.doi.org/10.1109/ICWS.2015.106";"ICWS";0
2786;"Nedgty: Web Services Firewall.";"597-601";2005;"2015-08-20";"http://doi.ieeecomputersociety.org/10.1109/ICWS.2005.84";"ICWS";0
2787;"Utility-based QoS Brokering in Service Oriented Architectures.";"422-430";2007;"2015-08-20";"http://doi.ieeecomputersociety.org/10.1109/ICWS.2007.186";"ICWS";0
2788;"Mashup Advisor: A Recommendation Tool for Mashup Development.";"337-344";2008;"2015-08-20";"http://doi.ieeecomputersociety.org/10.1109/ICWS.2008.128";"ICWS";0
2789;"Mashing-Up Rich User Interfaces for Human-Interaction in WS-BPEL.";"559-566";2010;"2015-08-20";"http://doi.ieeecomputersociety.org/10.1109/ICWS.2010.18";"ICWS";0
2790;"Discovery of Semantic Relations between Web Services.";"357-364";2006;"2015-08-20";"http://doi.ieeecomputersociety.org/10.1109/ICWS.2006.53";"ICWS";0
2791;"A Flexible Approach for Automatic Process Decentralization Using Dependency Tables.";"847-855";2009;"2015-08-20";"http://doi.ieeecomputersociety.org/10.1109/ICWS.2009.41";"ICWS";0
2792;"Expressing and Reasoning about Service Contracts in Service-Oriented Computing.";"915-918";2006;"2015-08-20";"http://doi.ieeecomputersociety.org/10.1109/ICWS.2006.62";"ICWS";0
2793;"Mutation Test Based on OWL-S Requirement Model.";"1006-1007";2009;"2015-08-20";"http://doi.ieeecomputersociety.org/10.1109/ICWS.2009.129";"ICWS";0
2794;"Web Service Recommendation Based on Watchlist via Temporal and Tag Preference Fusion.";"281-288";2014;"2016-01-05";"http://doi.ieeecomputersociety.org/10.1109/ICWS.2014.49";"ICWS";0
2795;"Axis2, Middleware for Next Generation Web Services.";"833-840";2006;"2015-08-20";"http://doi.ieeecomputersociety.org/10.1109/ICWS.2006.36";"ICWS";0
2796;"Finding Preferred Skyline Solutions for SLA-Constrained Service Composition.";"195-202";2013;"2015-08-20";"http://doi.ieeecomputersociety.org/10.1109/ICWS.2013.35";"ICWS";0
2797;"Time-Aware API Popularity Prediction via Heterogeneous Features.";"424-431";2015;"2015-08-19";"http://dx.doi.org/10.1109/ICWS.2015.63";"ICWS";0
2798;"Semi-automatic Integration of Web Service Interfaces.";"307-314";2010;"2015-08-20";"http://doi.ieeecomputersociety.org/10.1109/ICWS.2010.28";"ICWS";0
2799;"A Polyarchical Middleware for Self-Regenerative Invocation of Multi-Standard Ubiquitous Services.";"410-";2004;"2015-08-20";"http://doi.ieeecomputersociety.org/10.1109/ICWS.2004.1314765";"ICWS";0
2800;"Inferring Data Contract for Web-Based API.";"65-72";2014;"2015-08-20";"http://doi.ieeecomputersociety.org/10.1109/ICWS.2014.22";"ICWS";0
2801;"Comparing Web Services with other Software Components.";"388-397";2007;"2015-08-20";"http://doi.ieeecomputersociety.org/10.1109/ICWS.2007.64";"ICWS";0
2802;"Web Services for Information Extraction from the Web.";"279-";2004;"2015-08-20";"http://doi.ieeecomputersociety.org/10.1109/ICWS.2004.1314749";"ICWS";0
2803;"Selective Querying for Adapting Hierarchical Web Service Compositions Using Aggregate Volatility.";"43-50";2009;"2015-08-20";"http://doi.ieeecomputersociety.org/10.1109/ICWS.2009.112";"ICWS";0
2804;"A Semantic QoS-Aware Discovery Framework for Web Services.";"129-136";2008;"2015-08-20";"http://doi.ieeecomputersociety.org/10.1109/ICWS.2008.44";"ICWS";0
2805;"Efficient Discovery of Collision-Free Service Combinations.";"165-172";2009;"2015-08-20";"http://doi.ieeecomputersociety.org/10.1109/ICWS.2009.105";"ICWS";0
2806;"A Web Service Composition and Deployment Framework for Scientific Workflows.";"814-";2004;"2015-08-20";"http://doi.ieeecomputersociety.org/10.1109/ICWS.2004.1314956";"ICWS";0
2807;"Towards Automated RESTful Web Service Composition.";"189-196";2009;"2015-08-20";"http://doi.ieeecomputersociety.org/10.1109/ICWS.2009.111";"ICWS";0
2808;"LiveMig: An Approach to Live Instance Migration in Composite Service Evolution.";"679-686";2009;"2015-08-20";"http://doi.ieeecomputersociety.org/10.1109/ICWS.2009.96";"ICWS";0
2809;"An Intrusion Tolerant Identity Management Infrastructure for Cloud Computing Services.";"155-162";2013;"2015-08-20";"http://doi.ieeecomputersociety.org/10.1109/ICWS.2013.30";"ICWS";0
2810;"Accelerated Sparse Learning on Tag Annotation for Web Service Discovery.";"265-272";2015;"2015-08-19";"http://dx.doi.org/10.1109/ICWS.2015.44";"ICWS";0
2811;"Mapping a Business Process Model to a Semantic Web Service Model.";"746-";2004;"2015-08-20";"http://doi.ieeecomputersociety.org/10.1109/ICWS.2004.1314808";"ICWS";0
2812;"Combining Query and Preference - An Approach to Fully Automatize Dynamic Service Binding.";"788-791";2004;"2015-08-20";"http://doi.ieeecomputersociety.org/10.1109/ICWS.2004.1314822";"ICWS";0
2813;"An SOA-based Framework for Instrument Management for Large-scale Observing Systems (USArray Case Study).";"815-822";2006;"2015-08-20";"http://doi.ieeecomputersociety.org/10.1109/ICWS.2006.29";"ICWS";0
2814;"A Web Services Specification for the Healthcare Enterprise as a Unified Approach to the Exchange of Medical Information.";"292-298";2003;"2003-10-17";" ";"ICWS";0
2815;"Efficient Testing of Service-Oriented Applications Using Semantic Service Stubs.";"197-204";2009;"2015-08-20";"http://doi.ieeecomputersociety.org/10.1109/ICWS.2009.40";"ICWS";0
2816;"Security Assurance of Services through Digital Security Certificates.";"539-546";2013;"2015-08-20";"http://doi.ieeecomputersociety.org/10.1109/ICWS.2013.78";"ICWS";0
2817;"2014 IEEE International Conference on Web Services, ICWS, 2014, Anchorage, AK, USA, June 27 - July 2, 2014";"not available";2014;"2015-08-19";"http://www.computer.org/csdl/proceedings/icws/2014/5054/00/index.html";"ICWS";0
2818;"An Energy-Efficient Inter-organizational Wireless Sensor Data Collection Framework.";"639-646";2015;"2015-08-19";"http://dx.doi.org/10.1109/ICWS.2015.90";"ICWS";0
2819;"Business Process Development based on Web Services: a Web Information System for Medical Image Management and Processing.";"807-814";2006;"2015-08-20";"http://doi.ieeecomputersociety.org/10.1109/ICWS.2006.41";"ICWS";0
2820;"Application of Management Frameworks to Manage Workflow-Based Systems: A Case Study on a Large Scale E-science Project.";"519-526";2009;"2015-08-20";"http://doi.ieeecomputersociety.org/10.1109/ICWS.2009.52";"ICWS";0
2821;"A Hybrid Local-Global Optimization Strategy for QoS-Aware Service Composition.";"735-738";2015;"2015-08-19";"http://dx.doi.org/10.1109/ICWS.2015.104";"ICWS";0
2822;"Guarding Sensitive Information Streams through the Jungle of Composite Web Services.";"455-462";2007;"2015-08-20";"http://doi.ieeecomputersociety.org/10.1109/ICWS.2007.93";"ICWS";0
2823;"Trust-based Resource Allocation in Web Services.";"663-672";2006;"2015-08-20";"http://doi.ieeecomputersociety.org/10.1109/ICWS.2006.135";"ICWS";0
2824;"Generating Minimal Protocol Adaptors for Loosely Coupled Services.";"417-424";2010;"2015-08-20";"http://doi.ieeecomputersociety.org/10.1109/ICWS.2010.14";"ICWS";0
2825;"Web Service Composition Integrating QoS Optimization and Redundancy Removal.";"203-210";2013;"2015-08-20";"http://doi.ieeecomputersociety.org/10.1109/ICWS.2013.36";"ICWS";0
2826;"Redundant Service Removal in QoS-Aware Service Composition.";"431-439";2012;"2015-08-20";"http://doi.ieeecomputersociety.org/10.1109/ICWS.2012.67";"ICWS";0
2827;"Web Service Orchestration Topic Mining.";"225-232";2014;"2015-08-20";"http://doi.ieeecomputersociety.org/10.1109/ICWS.2014.42";"ICWS";0
2828;"Service Recommendation for Mashup Composition with Implicit Correlation Regularization.";"217-224";2015;"2015-08-19";"http://dx.doi.org/10.1109/ICWS.2015.38";"ICWS";0
2829;"Extensible Web Services Architecture for Notification in Large-Scale Systems.";"383-392";2006;"2015-08-20";"http://doi.ieeecomputersociety.org/10.1109/ICWS.2006.63";"ICWS";0
2830;"Service Level Agreement Based Grid Scheduling.";"203-210";2008;"2015-08-20";"http://doi.ieeecomputersociety.org/10.1109/ICWS.2008.62";"ICWS";0
2831;"2015 IEEE International Conference on Web Services, ICWS 2015, New York, NY, USA, June 27 - July 2, 2015";"not available";2015;"2015-08-19";"http://ieeexplore.ieee.org/xpl/mostRecentIssue.jsp?punumber=7194373";"ICWS";0
2832;"Quality of Service Specification and Management for XML Web Services.";"not available";2005;"2015-08-20";"http://doi.ieeecomputersociety.org/10.1109/ICWS.2005.98";"ICWS";0
2833;"Adaptive Goals for Self-Adaptive Service Compositions.";"353-360";2010;"2015-08-20";"http://doi.ieeecomputersociety.org/10.1109/ICWS.2010.60";"ICWS";0
2834;"Explicit Representation of Service Semantics: Towards Automated Composition Through a Dynamically Re-Configurable Architectural Style for On Demand Computing.";"34-37";2003;"2003-10-17";" ";"ICWS";0
2835;"Location-Aware Collaborative Filtering for QoS-Based Service Recommendation.";"202-209";2012;"2015-08-20";"http://doi.ieeecomputersociety.org/10.1109/ICWS.2012.61";"ICWS";0
2836;"Continuous Query for QoS-Aware Automatic Service Composition.";"50-57";2012;"2015-08-20";"http://doi.ieeecomputersociety.org/10.1109/ICWS.2012.44";"ICWS";0
2837;"QoS-based Late-Binding of Service Invocations in Adaptive Business Processes.";"227-234";2010;"2015-08-20";"http://doi.ieeecomputersociety.org/10.1109/ICWS.2010.74";"ICWS";0
2838;"A MapReduce-Enabled Scientific Workflow Composition Framework.";"663-670";2009;"2015-08-20";"http://doi.ieeecomputersociety.org/10.1109/ICWS.2009.90";"ICWS";0
2839;"Hosting Web Services on Resource Constrained Devices.";"583-590";2007;"2015-08-20";"http://doi.ieeecomputersociety.org/10.1109/ICWS.2007.97";"ICWS";0
2840;"OWL-S Process Model Matchmaking.";"640-641";2010;"2015-08-20";"http://doi.ieeecomputersociety.org/10.1109/ICWS.2010.85";"ICWS";0
2841;"Learning Ontologies to Improve the Quality of Automatic Web Service Matching.";"118-125";2007;"2015-08-20";"http://doi.ieeecomputersociety.org/10.1109/ICWS.2007.114";"ICWS";0
2842;"Authorization Service for Web Services and its Implementation.";"774-777";2004;"2015-08-20";"http://doi.ieeecomputersociety.org/10.1109/ICWS.2004.1314814";"ICWS";0
2843;"Message Correlation and Web Service Protocol Mining from Inaccurate Logs.";"259-266";2010;"2015-08-20";"http://doi.ieeecomputersociety.org/10.1109/ICWS.2010.104";"ICWS";0
2844;"Development of Service Control Server for Web-Telecom Coordination Service.";"600-607";2008;"2015-08-20";"http://doi.ieeecomputersociety.org/10.1109/ICWS.2008.17";"ICWS";0
2845;"A Resilient Framework for Fault Handling in Web Service Oriented Systems.";"663-670";2015;"2015-08-19";"http://dx.doi.org/10.1109/ICWS.2015.93";"ICWS";0
2846;"Improving Web Services Interoperability with Binding Extensions.";"873-879";2007;"2015-08-20";"http://doi.ieeecomputersociety.org/10.1109/ICWS.2007.108";"ICWS";0
2847;"Towards Improved Data Dissemination of Publish-Subscribe Systems.";"520-525";2010;"2015-08-20";"http://doi.ieeecomputersociety.org/10.1109/ICWS.2010.69";"ICWS";0
2848;"Flex-SwA: Flexible Exchange of Binary Data Based on SOAP Messages with Attachments.";"3-10";2006;"2015-08-20";"http://doi.ieeecomputersociety.org/10.1109/ICWS.2006.65";"ICWS";0
2849;"Large-Scale Longitudinal Analysis of SOAP-Based and RESTful Web Services.";"218-225";2012;"2015-08-20";"http://doi.ieeecomputersociety.org/10.1109/ICWS.2012.45";"ICWS";0
2850;"QoS Prediction of Web Services Based on Two-Phase K-Means Clustering.";"161-168";2015;"2015-08-19";"http://dx.doi.org/10.1109/ICWS.2015.31";"ICWS";0
2851;"Redundant-Free Web Services Composition Based on a Two-Phase Algorithm.";"361-368";2008;"2015-08-20";"http://doi.ieeecomputersociety.org/10.1109/ICWS.2008.91";"ICWS";0
2852;"Predicting QoS Values via Multi-dimensional QoS Data for Web Service Recommendations.";"249-256";2015;"2015-08-19";"http://dx.doi.org/10.1109/ICWS.2015.42";"ICWS";0
2853;"Using Scenario Oriented Response-time Management for Composite Web Services.";"1144-1145";2007;"2015-08-20";"http://doi.ieeecomputersociety.org/10.1109/ICWS.2007.183";"ICWS";0
2854;"Middleware for Communication and Deployment of Time Independent Mobile Web Services.";"797-800";2008;"2015-08-20";"http://doi.ieeecomputersociety.org/10.1109/ICWS.2008.20";"ICWS";0
2855;"Towards Effectively Identifying RESTful Web Services.";"518-525";2014;"2015-08-20";"http://doi.ieeecomputersociety.org/10.1109/ICWS.2014.79";"ICWS";0
