"id";"title";"pages";"year";"date";"url";"conference_name";"count"
896;"The Research on Context-Aware-Based Intelligent Service System for Miners.";"478-485";2012;"2012-10-08";"http://dx.doi.org/10.1109/SCC.2012.49";"IEEE SCC";0
897;"Toward a Flexible Bidding Strategy with Preference Analysis.";"619-626";2013;"2015-12-02";"http://doi.ieeecomputersociety.org/10.1109/SCC.2013.20";"IEEE SCC";0
898;"Cross Enterprise Improvements Delivered via a Cloud Platform: A Game Changer for the Consumer Product and Retail Industry.";"530-537";2010;"2015-12-02";"http://doi.ieeecomputersociety.org/10.1109/SCC.2010.35";"IEEE SCC";0
899;"State of the Art in Modeling and Deployment of Electronic Contracts.";"not available";2007;"2015-12-02";"http://doi.ieeecomputersociety.org/10.1109/SCC.2007.112";"IEEE SCC";0
900;"Multi-dimensional Knowledge Integration for Efficient Incident Management in a Services Cloud.";"57-64";2009;"2015-12-02";"http://doi.ieeecomputersociety.org/10.1109/SCC.2009.48";"IEEE SCC";0
901;"Gridcast1: A Grid and Web Service Broadcast Infrastructure.";"35-42";2005;"2015-12-02";"http://doi.ieeecomputersociety.org/10.1109/SCC.2005.57";"IEEE SCC";0
902;"Transforming Business Process Models: Enabling Programming at a Higher Level.";"173-180";2005;"2015-12-02";"http://doi.ieeecomputersociety.org/10.1109/SCC.2005.102";"IEEE SCC";0
903;"Estimating the Processing Time of Process Instances in Semi-structured Processes - A Case Study.";"368-375";2012;"2012-10-08";"http://dx.doi.org/10.1109/SCC.2012.12";"IEEE SCC";0
904;"Supporting Gene Expression Analysis Processes by a Service-Oriented Platform.";"739-746";2007;"2015-12-02";"http://doi.ieeecomputersociety.org/10.1109/SCC.2007.114";"IEEE SCC";0
905;"Co-Taverna: A Tool Supporting Collaborative Scientific Workflows.";"41-48";2010;"2015-12-02";"http://doi.ieeecomputersociety.org/10.1109/SCC.2010.99";"IEEE SCC";0
906;"2013 IEEE International Conference on Services Computing, Santa Clara, CA, USA, June 28 - July 3, 2013";"not available";2013;"2015-12-03";"http://www.computer.org/csdl/proceedings/scc/2013/5026/00/index.html";"IEEE SCC";0
907;"Efficient Seat Utilization in Global IT Delivery Service Systems.";"97-103";2009;"2015-12-02";"http://doi.ieeecomputersociety.org/10.1109/SCC.2009.68";"IEEE SCC";0
908;"Design Maintenance in Process Eco-Systems.";"392-399";2012;"2012-10-08";"http://dx.doi.org/10.1109/SCC.2012.104";"IEEE SCC";0
909;"A Spring Based Framework for Verification of Service Composition.";"258-265";2011;"2015-12-02";"http://doi.ieeecomputersociety.org/10.1109/SCC.2011.82";"IEEE SCC";0
910;"A Framework for Personalized Context-Aware Search of Ontology-Based Tagged Data.";"649-650";2010;"2015-12-02";"http://doi.ieeecomputersociety.org/10.1109/SCC.2010.73";"IEEE SCC";0
911;"Rating Credibility of Sources for Profiling Risk and Business Context of Service Requests.";"416-423";2014;"2015-12-02";"http://doi.ieeecomputersociety.org/10.1109/SCC.2014.62";"IEEE SCC";0
912;"How Clustering Enterprise Architectures helps to Design Service Oriented Architectures.";"269-272";2006;"2015-12-02";"http://doi.ieeecomputersociety.org/10.1109/SCC.2006.52";"IEEE SCC";0
913;"Self-Adaptive Fuzzy QoS-Driven Web Service Discovery.";"64-71";2011;"2015-12-02";"http://doi.ieeecomputersociety.org/10.1109/SCC.2011.87";"IEEE SCC";0
914;"Rectifying Prejudicial Feedback Ratings in Reputation based Trust Management.";"530-535";2007;"2015-12-02";"http://doi.ieeecomputersociety.org/10.1109/SCC.2007.91";"IEEE SCC";0
915;"Managing Faults in the Service Delivery Process of Service Provider Coalitions.";"65-72";2009;"2015-12-02";"http://doi.ieeecomputersociety.org/10.1109/SCC.2009.41";"IEEE SCC";0
916;"Towards Services Discovery Based on Service Goal Extraction and Recommendation.";"65-72";2013;"2015-12-02";"http://doi.ieeecomputersociety.org/10.1109/SCC.2013.16";"IEEE SCC";0
917;"Building a Service-Oriented eBanking Platform.";"237-244";2004;"2015-12-02";"http://doi.ieeecomputersociety.org/10.1109/SCC.2004.1358011";"IEEE SCC";0
918;"Mapping the QoS of the Services on the QoS of the Systems' Resources in an Adaptive Resource Management System.";"529-530";2006;"2015-12-02";"http://doi.ieeecomputersociety.org/10.1109/SCC.2006.66";"IEEE SCC";0
919;"Adaptive QoS-Aware Service Process Reconfiguration.";"282-289";2011;"2015-12-02";"http://doi.ieeecomputersociety.org/10.1109/SCC.2011.48";"IEEE SCC";0
920;"A Game Theoretic Approach for Analyzing the Efficiency of Web Services in Collaborative Networks.";"168-175";2011;"2015-12-02";"http://doi.ieeecomputersociety.org/10.1109/SCC.2011.76";"IEEE SCC";0
921;"Provisioning Norm: An Asymmetric Quality Measure for SaaS Resource Allocation.";"112-119";2011;"2015-12-02";"http://doi.ieeecomputersociety.org/10.1109/SCC.2011.16";"IEEE SCC";0
922;"QoS-Aware Service Composition for Converged Network-Cloud Service Provisioning.";"67-74";2014;"2015-12-02";"http://doi.ieeecomputersociety.org/10.1109/SCC.2014.18";"IEEE SCC";0
923;"Optimal Design for Cloud Infrastructure in Multi-layer Service Computing Environment.";"328-335";2012;"2012-10-08";"http://dx.doi.org/10.1109/SCC.2012.68";"IEEE SCC";0
924;"Measuring Compliance and Deviations in a Template-Based Service Contract Development Process.";"289-296";2010;"2015-12-02";"http://doi.ieeecomputersociety.org/10.1109/SCC.2010.50";"IEEE SCC";0
925;"Intelligent Document Gateway - A Ser vice System Analysis.";"636-643";2007;"2015-12-02";"http://doi.ieeecomputersociety.org/10.1109/SCC.2007.73";"IEEE SCC";0
926;"Job Scheduling of Savant for Grid Computing on RFID EPC Network.";"75-84";2005;"2015-12-02";"http://doi.ieeecomputersociety.org/10.1109/SCC.2005.59";"IEEE SCC";0
927;"A Framework of a Tree-based Grid Information Service.";"255-256";2005;"2015-12-02";"http://doi.ieeecomputersociety.org/10.1109/SCC.2005.11";"IEEE SCC";0
928;"Optimistic Fair-exchange Protocols Based on DSA Signatures.";"498-501";2004;"2015-12-02";"http://doi.ieeecomputersociety.org/10.1109/SCC.2004.1358051";"IEEE SCC";0
929;"Context-enabled B2B Collaborations.";"240-243";2007;"2015-12-02";"http://doi.ieeecomputersociety.org/10.1109/SCC.2007.47";"IEEE SCC";0
930;"Capability Diagnostics of Enterprise Service Architectures Using a Dedicated Software Architecture Reference Model.";"592-599";2011;"2015-12-02";"http://doi.ieeecomputersociety.org/10.1109/SCC.2011.103";"IEEE SCC";0
931;"Psi-CAL: Foundations of a Programming Language for Services Computing.";"721-728";2013;"2015-12-02";"http://doi.ieeecomputersociety.org/10.1109/SCC.2013.50";"IEEE SCC";0
932;"Progressive Auction Based Resource Allocation in Service-Oriented Architecture.";"85-92";2005;"2015-12-02";"http://doi.ieeecomputersociety.org/10.1109/SCC.2005.73";"IEEE SCC";0
933;"QoS-Aware Optimization of Composite-Service Fulfillment Policy.";"11-19";2007;"2015-12-02";"http://doi.ieeecomputersociety.org/10.1109/SCC.2007.90";"IEEE SCC";0
934;"Regret-Based Decentralized Adaptation ofWeb Processes with Coordination Constraints.";"262-269";2007;"2015-12-02";"http://doi.ieeecomputersociety.org/10.1109/SCC.2007.92";"IEEE SCC";0
935;"A Business Centric Monitoring Approach for Heterogeneous Service Composites.";"671-678";2011;"2015-12-02";"http://doi.ieeecomputersociety.org/10.1109/SCC.2011.70";"IEEE SCC";0
936;"High Performance Computing as a Service with Service Level Agreements.";"578-585";2012;"2012-10-08";"http://dx.doi.org/10.1109/SCC.2012.43";"IEEE SCC";0
937;"An OO based Semantic Model for Service Oriented Computing.";"85-93";2006;"2015-12-02";"http://doi.ieeecomputersociety.org/10.1109/SCC.2006.20";"IEEE SCC";0
938;"Leverage Personal Cloud Storage Services to Provide Shared Storage for Team Collaboration.";"613-620";2014;"2015-12-02";"http://doi.ieeecomputersociety.org/10.1109/SCC.2014.86";"IEEE SCC";0
939;"Beyond SOA: Context-Aware Composite Services.";"514";2006;"2015-12-02";"http://doi.ieeecomputersociety.org/10.1109/SCC.2006.26";"IEEE SCC";0
940;"INSC: An Iterative Negotiation Approach for Service Compositions.";"170-177";2012;"2012-10-08";"http://dx.doi.org/10.1109/SCC.2012.38";"IEEE SCC";0
941;"PSRPS: A Workload Pattern Sensitive Resource Provisioning Scheme for Cloud Systems.";"344-351";2013;"2015-12-02";"http://doi.ieeecomputersociety.org/10.1109/SCC.2013.49";"IEEE SCC";0
942;"Value-Based Service Contract Selection.";"611-618";2013;"2015-12-02";"http://doi.ieeecomputersociety.org/10.1109/SCC.2013.13";"IEEE SCC";0
943;"Variation-Oriented Analysis for SOA Solution Design.";"560-568";2007;"2015-12-02";"http://doi.ieeecomputersociety.org/10.1109/SCC.2007.127";"IEEE SCC";0
944;"A Quantitative and Qualitative Approach for NFP-Aware Web Service Composition.";"202-209";2012;"2012-10-08";"http://dx.doi.org/10.1109/SCC.2012.16";"IEEE SCC";0
945;"Protecting Sensitive Customer Information in Call Center Recordings.";"81-88";2009;"2015-12-02";"http://doi.ieeecomputersociety.org/10.1109/SCC.2009.51";"IEEE SCC";0
946;"Formal Modeling of Elastic Service-Based Business Processes.";"424-431";2013;"2015-12-02";"http://doi.ieeecomputersociety.org/10.1109/SCC.2013.75";"IEEE SCC";0
947;"IEEE International Conference on Services Computing, SCC 2014, Anchorage, AK, USA, June 27 - July 2, 2014";"not available";2014;"2015-12-01";"http://www.computer.org/csdl/proceedings/scc/2014/5066/00/index.html";"IEEE SCC";0
948;"Accountability as a Service for the Cloud.";"81-88";2010;"2015-12-02";"http://doi.ieeecomputersociety.org/10.1109/SCC.2010.83";"IEEE SCC";0
949;"Multi Domain-Specific Modeling of the Security Concerns of Service-Oriented Architectures.";"761-762";2011;"2015-12-02";"http://doi.ieeecomputersociety.org/10.1109/SCC.2011.102";"IEEE SCC";0
950;"Web Service andWorkflow Abstractions to Large Scale Nuclear Physics Calculations.";"703-710";2012;"2012-10-08";"http://dx.doi.org/10.1109/SCC.2012.112";"IEEE SCC";0
951;"A Real-Time Risk Assessment and Mitigation Engine Based on Dynamic Context.";"663-670";2011;"2015-12-02";"http://doi.ieeecomputersociety.org/10.1109/SCC.2011.74";"IEEE SCC";0
952;"Extending an Instant Messaging System with Data Services and Mashups Thereof.";"848-849";2014;"2015-12-02";"http://doi.ieeecomputersociety.org/10.1109/SCC.2014.119";"IEEE SCC";0
953;"WS-CDSP: A Novel Web Services-Based Content Delivery Service Peering Scheme.";"348-355";2009;"2015-12-02";"http://doi.ieeecomputersociety.org/10.1109/SCC.2009.73";"IEEE SCC";0
954;"Resource Allocation and SLA Determination for Large Data Processing Services over Cloud.";"522-529";2010;"2015-12-02";"http://doi.ieeecomputersociety.org/10.1109/SCC.2010.92";"IEEE SCC";0
955;"SLA Driven Process Security through Monitored E-contracts.";"28-35";2007;"2015-12-02";"http://doi.ieeecomputersociety.org/10.1109/SCC.2007.109";"IEEE SCC";0
956;"Quality of Service Specification and Management for XML Web Services.";"not available";2005;"2015-12-02";"http://doi.ieeecomputersociety.org/10.1109/SCC.2005.76";"IEEE SCC";0
957;"Web Services Conversion.";"672-673";2007;"2015-12-02";"http://doi.ieeecomputersociety.org/10.1109/SCC.2007.132";"IEEE SCC";0
958;"Service-Oriented Grid Architecture and Middleware Technologies for Collaborative E-Learning.";"67-74";2005;"2015-12-02";"http://doi.ieeecomputersociety.org/10.1109/SCC.2005.87";"IEEE SCC";0
959;"Web Service Selection Based on Similarity Evaluation.";"322-329";2011;"2015-12-02";"http://doi.ieeecomputersociety.org/10.1109/SCC.2011.50";"IEEE SCC";0
960;"Effective Reuse via Modeling, Managing and Searching of Business Process Assets.";"462-469";2012;"2012-10-08";"http://dx.doi.org/10.1109/SCC.2012.46";"IEEE SCC";0
961;"Hybrid Role Mining for Security Service Solution.";"210-217";2012;"2012-10-08";"http://dx.doi.org/10.1109/SCC.2012.57";"IEEE SCC";0
962;"Design Pattern for Object Triple Mapping.";"443-450";2009;"2015-12-02";"http://doi.ieeecomputersociety.org/10.1109/SCC.2009.54";"IEEE SCC";0
963;"A Multi-agent Reinforcement Learning Model for Service Composition.";"681-682";2012;"2012-10-08";"http://dx.doi.org/10.1109/SCC.2012.58";"IEEE SCC";0
964;"OdinTools-Model-Driven Development of Intelligent Mobile Services.";"448-455";2011;"2015-12-02";"http://doi.ieeecomputersociety.org/10.1109/SCC.2011.73";"IEEE SCC";0
965;"Impact of Business Service Modes on Distribution Systems: A Reinforcement Learning Approach.";"294-299";2007;"2015-12-02";"http://doi.ieeecomputersociety.org/10.1109/SCC.2007.69";"IEEE SCC";0
966;"Migration to Multi-image Cloud Templates.";"80-87";2011;"2015-12-02";"http://doi.ieeecomputersociety.org/10.1109/SCC.2011.89";"IEEE SCC";0
967;"Automatic Web Service Composition.";"not available";2006;"2015-12-02";"http://doi.ieeecomputersociety.org/10.1109/SCC.2006.25";"IEEE SCC";0
968;"A SRP Based Handler for Web Service Access Control.";"57-62";2004;"2015-12-02";"http://doi.ieeecomputersociety.org/10.1109/SCC.2004.1357990";"IEEE SCC";0
969;"Study on the Behavior-based Trust Model in Grid Security System.";"506-509";2004;"2015-12-02";"http://doi.ieeecomputersociety.org/10.1109/SCC.2004.1358053";"IEEE SCC";0
970;"Optimal Asynchronous Service Scheduling in BISON.";"510";2006;"2015-12-02";"http://doi.ieeecomputersociety.org/10.1109/SCC.2006.78";"IEEE SCC";0
971;"Efficient Dynamic Methods for Predictive Action Strategy Optimization for Risk Driven Multi-channel Communication.";"552-559";2014;"2015-12-02";"http://doi.ieeecomputersociety.org/10.1109/SCC.2014.78";"IEEE SCC";0
972;"Optimal Negotiation of Service Level Agreements for Cloud-Based Services through Autonomous Agents.";"59-66";2014;"2015-12-02";"http://doi.ieeecomputersociety.org/10.1109/SCC.2014.17";"IEEE SCC";0
973;"Defining Metrics for Loose Coupling Evaluation in Service Composition.";"362-369";2010;"2015-12-02";"http://doi.ieeecomputersociety.org/10.1109/SCC.2010.17";"IEEE SCC";0
974;"HOC-SA: A Grid Service Architecture for Higher-Order Components.";"288-294";2004;"2015-12-02";"http://doi.ieeecomputersociety.org/10.1109/SCC.2004.1358017";"IEEE SCC";0
975;"Trust Evaluation in Composite Services Selection and Discovery.";"482-485";2009;"2015-12-02";"http://doi.ieeecomputersociety.org/10.1109/SCC.2009.70";"IEEE SCC";0
976;"Quantifying Consistency between Conceptual and Executable Business Processes.";"9-16";2013;"2015-12-02";"http://doi.ieeecomputersociety.org/10.1109/SCC.2013.47";"IEEE SCC";0
977;"A Scalable Accounting Solution for Prepaid Services in Cloud Systems.";"81-89";2012;"2013-03-07";"http://dx.doi.org/10.1109/SCC.2012.40";"IEEE SCC";0
978;"Service Level Agreement Aware Workflow Scheduling.";"715-716";2007;"2015-12-02";"http://doi.ieeecomputersociety.org/10.1109/SCC.2007.99";"IEEE SCC";0
979;"A Dynamic Two-Phase Commit Protocol for Self-Adapting Services.";"7-15";2004;"2015-12-02";"http://doi.ieeecomputersociety.org/10.1109/SCC.2004.1357984";"IEEE SCC";0
980;"Patterns for Monitoring Parallel Processes.";"9-16";2014;"2015-12-02";"http://doi.ieeecomputersociety.org/10.1109/SCC.2014.11";"IEEE SCC";0
981;"Towards a Plug-and-Play B2B Marketing Tool Based on Time-Sensitive Information Extraction.";"821-828";2014;"2015-12-02";"http://doi.ieeecomputersociety.org/10.1109/SCC.2014.111";"IEEE SCC";0
982;"Application Framework for Efficient Development of Sensor as a Service for Home Network System.";"576-583";2011;"2015-12-02";"http://doi.ieeecomputersociety.org/10.1109/SCC.2011.18";"IEEE SCC";0
983;"A Framework for Detecting Anomalous Services in OSGi-Based Applications.";"250-257";2012;"2012-10-08";"http://dx.doi.org/10.1109/SCC.2012.59";"IEEE SCC";0
984;"Service Commons - Serve and Serve Alike: Applying the Creative Commons Spirit to Web Services.";"1-8";2012;"2012-10-08";"http://dx.doi.org/10.1109/SCC.2012.93";"IEEE SCC";0
985;"An Efficient Data Maintenance Model for Data Service Mashup.";"699-700";2012;"2012-10-08";"http://dx.doi.org/10.1109/SCC.2012.10";"IEEE SCC";0
986;"SOMP: Service-Oriented Multi Processors.";"709-716";2011;"2015-12-02";"http://doi.ieeecomputersociety.org/10.1109/SCC.2011.26";"IEEE SCC";0
987;"Automatically Deriving Choreography-Conforming Systems of Services.";"9-16";2009;"2015-12-02";"http://doi.ieeecomputersociety.org/10.1109/SCC.2009.52";"IEEE SCC";0
988;"2010 IEEE International Conference on Services Computing, SCC 2010, Miami, Florida, USA, July 5-10, 2010";"not available";2010;"2015-12-01";"http://www.computer.org/csdl/proceedings/scc/2010/4126/00/index.html";"IEEE SCC";0
989;"Reputation-Aware QoS Value Prediction of Web Services.";"41-48";2013;"2015-12-02";"http://doi.ieeecomputersociety.org/10.1109/SCC.2013.43";"IEEE SCC";0
990;"An Approach for Modeling and Analyzing Mobile Push Notification Services.";"725-732";2014;"2015-12-02";"http://doi.ieeecomputersociety.org/10.1109/SCC.2014.99";"IEEE SCC";0
991;"""Google by Reformulation"""": Modeling Search as Successive Refinement.""";"435-440";2004;"2015-12-02";"http://doi.ieeecomputersociety.org/10.1109/SCC.2004.1358037";"IEEE SCC";0
992;"Secure Cloud Storage Service with an Efficient DOKS Protocol.";"208-215";2013;"2015-12-02";"http://doi.ieeecomputersociety.org/10.1109/SCC.2013.37";"IEEE SCC";0
993;"Prioritizing and Scheduling Service Requests under Time Constraints.";"1-8";2014;"2015-12-02";"http://doi.ieeecomputersociety.org/10.1109/SCC.2014.10";"IEEE SCC";0
994;"Assessing the Risk and Value of Adopting Emerging and Unstable Web Services Specifications.";"65-72";2004;"2015-12-02";"http://doi.ieeecomputersociety.org/10.1109/SCC.2004.1357991";"IEEE SCC";0
995;"Clustering IT Events around Common Root Causes.";"749-757";2014;"2015-12-02";"http://doi.ieeecomputersociety.org/10.1109/SCC.2014.102";"IEEE SCC";0
996;"Discovering Service Similarity by Testing.";"733-734";2011;"2015-12-02";"http://doi.ieeecomputersociety.org/10.1109/SCC.2011.91";"IEEE SCC";0
997;"How Physical Objects and Business Workflows Can Be Correlated.";"226-233";2011;"2015-12-02";"http://doi.ieeecomputersociety.org/10.1109/SCC.2011.24";"IEEE SCC";0
998;"A Business Centric End-to-End Monitoring Approach for Service Composites.";"409-416";2010;"2015-12-02";"http://doi.ieeecomputersociety.org/10.1109/SCC.2010.45";"IEEE SCC";0
999;"Resource State Monitoring of Service Transactions in Cloud Systems.";"512-519";2014;"2015-12-02";"http://doi.ieeecomputersociety.org/10.1109/SCC.2014.74";"IEEE SCC";0
1000;"A Continuous Long Running Batch Orchestration Model for Workflow Instance Migration.";"226-233";2010;"2015-12-02";"http://doi.ieeecomputersociety.org/10.1109/SCC.2010.90";"IEEE SCC";0
1001;"Analysis of Scientific Workflow Provenance Access Control Policies.";"266-273";2012;"2012-10-08";"http://dx.doi.org/10.1109/SCC.2012.60";"IEEE SCC";0
1002;"An Agent-based Resource Allocation Model for Grid Computing.";"311-314";2005;"2015-12-02";"http://doi.ieeecomputersociety.org/10.1109/SCC.2005.114";"IEEE SCC";0
1003;"Describing and Verifying Web Service Composition Using TLA Reasoning.";"234-241";2010;"2015-12-02";"http://doi.ieeecomputersociety.org/10.1109/SCC.2010.28";"IEEE SCC";0
1004;"Xi-Calculus: A Calculus for Service Interactions.";"105-113";2010;"2015-12-02";"http://doi.ieeecomputersociety.org/10.1109/SCC.2010.49";"IEEE SCC";0
1005;"Personalized Active Service Spaces for End-User Service Composition.";"198-205";2006;"2015-12-02";"http://doi.ieeecomputersociety.org/10.1109/SCC.2006.80";"IEEE SCC";0
1006;"Event-Driven SOA for IoT Services.";"629-636";2014;"2015-12-02";"http://doi.ieeecomputersociety.org/10.1109/SCC.2014.88";"IEEE SCC";0
1007;"A Distributed Service Management Infrastructure for Enterprise Data Centers Based on Peer-to-Peer Technology.";"52-59";2006;"2015-12-02";"http://doi.ieeecomputersociety.org/10.1109/SCC.2006.2";"IEEE SCC";0
1008;"Committees.";"not available";2005;"2015-12-02";"http://doi.ieeecomputersociety.org/10.1109/SCC.2005.38";"IEEE SCC";0
1009;"Supporting Intercultural Collaboration: An Agent Coordination Workflow Model.";"629-632";2004;"2015-12-02";"http://doi.ieeecomputersociety.org/10.1109/SCC.2004.1358079";"IEEE SCC";0
1010;"Towards Agricultural Marketing Reforms: Web Services Orchestration Approach.";"260-270";2005;"2015-12-02";"http://doi.ieeecomputersociety.org/10.1109/SCC.2005.100";"IEEE SCC";0
1011;"Effective Knowledge Sharing in Service Systems.";"498-501";2009;"2015-12-02";"http://doi.ieeecomputersociety.org/10.1109/SCC.2009.62";"IEEE SCC";0
1012;"Service Views: a Coherent View Model of the SOA in the Enterprise.";"230-237";2006;"2015-12-02";"http://doi.ieeecomputersociety.org/10.1109/SCC.2006.91";"IEEE SCC";0
1013;"A Workflow Services Middleware Model on ShanghaiGrid.";"366-371";2004;"2015-12-02";"http://doi.ieeecomputersociety.org/10.1109/SCC.2004.1358026";"IEEE SCC";0
1014;"Utility Decomposition and Surplus Redistribution in Composite SLA Negotiation.";"627-630";2010;"2015-12-02";"http://doi.ieeecomputersociety.org/10.1109/SCC.2010.52";"IEEE SCC";0
1015;"Managing Web Service Dynamic Changes at Run-Time Based on Bayesian Network.";"674-675";2012;"2012-10-08";"http://dx.doi.org/10.1109/SCC.2012.61";"IEEE SCC";0
1016;"A Multi-dimensional Social Tagging Method for Semantic Web Services.";"735-736";2011;"2015-12-02";"http://doi.ieeecomputersociety.org/10.1109/SCC.2011.49";"IEEE SCC";0
1017;"On the Union of Chord-like Networks.";"536-540";2004;"2015-12-02";"http://doi.ieeecomputersociety.org/10.1109/SCC.2004.1358059";"IEEE SCC";0
1018;"Flow Editor: Semantic Web Service Composition Tool.";"666-667";2012;"2012-10-08";"http://dx.doi.org/10.1109/SCC.2012.48";"IEEE SCC";0
1019;"SmartClass: A Services-Oriented Approach for University Resource Scheduling.";"745-746";2013;"2015-12-02";"http://doi.ieeecomputersociety.org/10.1109/SCC.2013.29";"IEEE SCC";0
1020;"Personal Emergency Preparedness Plan (PEPP) Facebook App: Using Cloud Computing, Mobile Technology, and Social Networking Services to Decompress Traditional Channels of Communication during Emergencies and Disasters.";"494-498";2012;"2014-01-18";"http://dx.doi.org/10.1109/SCC.2012.106";"IEEE SCC";0
1021;"Mobility Management for Seamless Flow of Real Time Information in Heterogeneous Networks.";"524-527";2009;"2015-12-02";"http://doi.ieeecomputersociety.org/10.1109/SCC.2009.83";"IEEE SCC";0
1022;"Towards Provenance Aware Design of Service Compositions: A Methodology for Analysing the Provenance Awareness in Service Designs.";"761-762";2013;"2015-12-02";"http://doi.ieeecomputersociety.org/10.1109/SCC.2013.17";"IEEE SCC";0
1023;"On-Demand One-Time Overlay Multicast Tree for Multimedia Transmission over Large Internet Environment.";"541-546";2004;"2015-12-02";"http://doi.ieeecomputersociety.org/10.1109/SCC.2004.1358060";"IEEE SCC";0
1024;"Managing Software Assets in a Global Enterprise.";"560-567";2011;"2015-12-02";"http://doi.ieeecomputersociety.org/10.1109/SCC.2011.119";"IEEE SCC";0
1025;"A Novel Approach to Improving the Efficiency of Storing and Accessing Small Files on Hadoop: A Case Study by PowerPoint Files.";"65-72";2010;"2015-12-02";"http://doi.ieeecomputersociety.org/10.1109/SCC.2010.72";"IEEE SCC";0
1026;"An Information Model for Managing Service Lifecycle Resources.";"502-504";2009;"2015-12-02";"http://doi.ieeecomputersociety.org/10.1109/SCC.2009.38";"IEEE SCC";0
1027;"An Efficient Algorithm for Strategy-Proof Service Composition.";"105-112";2013;"2015-12-02";"http://doi.ieeecomputersociety.org/10.1109/SCC.2013.100";"IEEE SCC";0
1028;"Short Circuit Switch An Intelligent Web Services Discovery and Invocation Engine.";"241-242";2005;"2015-12-02";"http://doi.ieeecomputersociety.org/10.1109/SCC.2005.92";"IEEE SCC";0
1029;"2004 IEEE International Conference on Services Computing (SCC 2004), 15-18 September 2004, Shanghai, China";"not available";2004;"2015-12-01";"http://www.computer.org/csdl/proceedings/scc/2004/2225/00/index.html";"IEEE SCC";0
1030;"From BPEL4WS to OWL-S: Integrating E-Business Process Descriptions.";"181-190";2005;"2015-12-02";"http://doi.ieeecomputersociety.org/10.1109/SCC.2005.54";"IEEE SCC";0
1031;"Case Study to Verify the Interoperability of a Service Oriented Architecture Stack.";"678-679";2007;"2015-12-02";"http://doi.ieeecomputersociety.org/10.1109/SCC.2007.39";"IEEE SCC";0
1032;"Probabilistic Critical Path Identification for Cost-Effective Monitoring of Service-Based Systems.";"178-185";2012;"2012-10-08";"http://dx.doi.org/10.1109/SCC.2012.39";"IEEE SCC";0
1033;"A Language-based Approach to Service Deployment.";"69-76";2006;"2015-12-02";"http://doi.ieeecomputersociety.org/10.1109/SCC.2006.9";"IEEE SCC";0
1034;"A Fine-Grained Access Control Model for Web Services.";"33-40";2004;"2015-12-02";"http://doi.ieeecomputersociety.org/10.1109/SCC.2004.1357987";"IEEE SCC";0
1035;"A Service Discovery Framework based on Linear Composition.";"536-543";2007;"2015-12-02";"http://doi.ieeecomputersociety.org/10.1109/SCC.2007.15";"IEEE SCC";0
1036;"An Infrastructure Framework for Deploying Enterprise Private Cloud.";"502-510";2013;"2015-12-02";"http://doi.ieeecomputersociety.org/10.1109/SCC.2013.99";"IEEE SCC";0
1037;"Combining Von Neumann Neighborhood Topology with Approximate-Mapping Local Search for ABC-Based Service Composition.";"187-194";2014;"2015-12-02";"http://doi.ieeecomputersociety.org/10.1109/SCC.2014.33";"IEEE SCC";0
1038;"VICOS: A Framework for Session Management in Network Computing Infrastructure.";"647-650";2004;"2015-12-02";"http://doi.ieeecomputersociety.org/10.1109/SCC.2004.1358083";"IEEE SCC";0
1039;"SOA-Scanner: An Integrated Tool to Detect Vulnerabilities in Service-Based Infrastructures.";"280-287";2013;"2015-12-02";"http://doi.ieeecomputersociety.org/10.1109/SCC.2013.28";"IEEE SCC";0
1040;"An Approach to Deliver an Early Return on Investment during the Development of a Corporate Web Portal.";"175-184";2005;"2015-12-02";"http://doi.ieeecomputersociety.org/10.1109/SCC.2005.25";"IEEE SCC";0
1041;"Quality of Web Service Prediction by Collective Matrix Factorization.";"432-439";2014;"2015-12-02";"http://doi.ieeecomputersociety.org/10.1109/SCC.2014.64";"IEEE SCC";0
1042;"Efficient Coalition Formation for Web Services.";"737-744";2013;"2015-12-02";"http://doi.ieeecomputersociety.org/10.1109/SCC.2013.79";"IEEE SCC";0
