"id";"title";"pages";"year";"date";"url";"conference_name";"count"
1;"SaaS Architecture and Pricing Models.";"597-604";2014;"2015-12-02";"http://doi.ieeecomputersociety.org/10.1109/SCC.2014.84";"IEEE SCC";0
2;"A Public-View Approach to Timed Properties Verification for B2B Web Service Compositions.";"427-434";2009;"2015-12-02";"http://doi.ieeecomputersociety.org/10.1109/SCC.2009.18";"IEEE SCC";0
3;"Queueing Network-based Optimisation Techniques for Workload Allocation in Clusters of Computers.";"207-216";2004;"2015-12-02";"http://doi.ieeecomputersociety.org/10.1109/SCC.2004.1358008";"IEEE SCC";0
4;"Towards Green Business Process Management.";"386-393";2010;"2015-12-02";"http://doi.ieeecomputersociety.org/10.1109/SCC.2010.21";"IEEE SCC";0
5;"A Human-Asset-Compromised Allocation Model of Multiple Emergency Projects in Service-Focused Enterprises.";"360-367";2012;"2012-10-08";"http://dx.doi.org/10.1109/SCC.2012.89";"IEEE SCC";0
6;"Policy-Aware Service Composition in Sensor Networks.";"186-193";2012;"2012-10-08";"http://dx.doi.org/10.1109/SCC.2012.90";"IEEE SCC";0
7;"Segmenting the Web Document with Document Object Model.";"449-452";2004;"2015-12-02";"http://doi.ieeecomputersociety.org/10.1109/SCC.2004.1358040";"IEEE SCC";0
8;"Strategic Service Selection Problem for Transport Telematic Services - An Optimization Approach.";"520-527";2014;"2015-12-02";"http://doi.ieeecomputersociety.org/10.1109/SCC.2014.75";"IEEE SCC";0
9;"BRAHMA: Planning Tool for Providing Storage Management as a Service.";"1-10";2007;"2015-12-02";"http://doi.ieeecomputersociety.org/10.1109/SCC.2007.31";"IEEE SCC";0
10;"Performance Problems of Large Operational Systems Based on Web Services and a Solution.";"73-81";2004;"2015-12-02";"http://doi.ieeecomputersociety.org/10.1109/SCC.2004.1357992";"IEEE SCC";0
11;"Detection of Semantically Equivalent Fragments for Business Process Model Change Management.";"57-64";2010;"2015-12-02";"http://doi.ieeecomputersociety.org/10.1109/SCC.2010.38";"IEEE SCC";0
12;"A Holistic View of Industry Standards Across SOA Solution Stack.";"144-151";2009;"2015-12-02";"http://doi.ieeecomputersociety.org/10.1109/SCC.2009.42";"IEEE SCC";0
13;"Sensor Data as a Service - A Federated Platform for Mobile Data-centric Service Development and Sharing.";"446-453";2013;"2015-12-02";"http://doi.ieeecomputersociety.org/10.1109/SCC.2013.34";"IEEE SCC";0
14;"The Application of Utility Computing and Web-Services to Inventory Optimisation.";"185-191";2005;"2015-12-02";"http://doi.ieeecomputersociety.org/10.1109/SCC.2005.96";"IEEE SCC";0
15;"Linking contracts, processes and services: an event-driven approach.";"390-397";2006;"2015-12-02";"http://doi.ieeecomputersociety.org/10.1109/SCC.2006.64";"IEEE SCC";0
16;"A Multithreaded Resolution of the Service Selection Problem Based on Domain Decomposition and Work Stealing.";"424-431";2014;"2015-12-02";"http://doi.ieeecomputersociety.org/10.1109/SCC.2014.63";"IEEE SCC";0
17;"Constructing a Context-Aware Service-Oriented Reputation Model Using Attention Allocation Points.";"451-457";2009;"2015-12-02";"http://doi.ieeecomputersociety.org/10.1109/SCC.2009.55";"IEEE SCC";0
18;"An Optimal Capacity Planning Algorithm for Provisioning Cluster-Based Failure-Resilient Composite Services.";"112-119";2009;"2015-12-02";"http://doi.ieeecomputersociety.org/10.1109/SCC.2009.81";"IEEE SCC";0
19;"RMI: A Framework for Modeling and Evaluating the Resiliency Maturity of IT Service Organizations.";"300-307";2007;"2015-12-02";"http://doi.ieeecomputersociety.org/10.1109/SCC.2007.94";"IEEE SCC";0
20;"Recommend-As-You-Go: A Novel Approach Supporting Services-Oriented Scientific Workflow Reuse.";"48-55";2011;"2015-12-02";"http://doi.ieeecomputersociety.org/10.1109/SCC.2011.120";"IEEE SCC";0
21;"QoS Analysis and Service Selection for Composite Services.";"122-129";2010;"2015-12-02";"http://doi.ieeecomputersociety.org/10.1109/SCC.2010.16";"IEEE SCC";0
22;"Services and Autonomic Computing: A Practical Approach for Designing Manageability.";"41-48";2005;"2015-12-02";"http://doi.ieeecomputersociety.org/10.1109/SCC.2005.88";"IEEE SCC";0
23;"Service-based Collaborative Workflow for DAME.";"139-146";2005;"2015-12-02";"http://doi.ieeecomputersociety.org/10.1109/SCC.2005.84";"IEEE SCC";0
24;"Agent-Mediated Knowledge Sharing for Services Management.";"324-331";2007;"2015-12-02";"http://doi.ieeecomputersociety.org/10.1109/SCC.2007.23";"IEEE SCC";0
25;"Design and Implementation of a Unified Network Information Service.";"224-231";2013;"2015-12-02";"http://doi.ieeecomputersociety.org/10.1109/SCC.2013.81";"IEEE SCC";0
26;"Modeling, Analysis and Optimization of Dependability-Aware Energy Efficiency in Services Computing Systems.";"683-690";2013;"2015-12-02";"http://doi.ieeecomputersociety.org/10.1109/SCC.2013.63";"IEEE SCC";0
27;"Trade-Offs in a Google Distance and a WordNet Hybrid for QoS-Enabled Web Services Composition.";"312-319";2012;"2012-10-08";"http://dx.doi.org/10.1109/SCC.2012.77";"IEEE SCC";0
28;"Enhancing Penetration Testing with Attack Signatures and Interface Monitoring for the Detection of Injection Vulnerabilities in Web Services.";"104-111";2011;"2015-12-02";"http://doi.ieeecomputersociety.org/10.1109/SCC.2011.67";"IEEE SCC";0
29;"SOA Services and Solutions.";"not available";2006;"2015-12-02";"http://doi.ieeecomputersociety.org/10.1109/SCC.2006.96";"IEEE SCC";0
30;"On Exploiting System Dynamics Modeling to Identify Service Requirements.";"277-280";2006;"2015-12-02";"http://doi.ieeecomputersociety.org/10.1109/SCC.2006.76";"IEEE SCC";0
31;"A Security Meta-model for Service-Oriented Architectures.";"251-259";2009;"2015-12-02";"http://doi.ieeecomputersociety.org/10.1109/SCC.2009.57";"IEEE SCC";0
32;"ViPen: A Model Supporting Knowledge Provenance for Exploratory Service Composition.";"265-272";2010;"2015-12-02";"http://doi.ieeecomputersociety.org/10.1109/SCC.2010.44";"IEEE SCC";0
33;"Service Grid Federation Architecture for Heterogeneous Domains.";"539-546";2012;"2012-10-08";"http://dx.doi.org/10.1109/SCC.2012.101";"IEEE SCC";0
34;"Towards Battery-Aware Self-Adaptive Mobile Applications.";"439-445";2012;"2012-10-08";"http://dx.doi.org/10.1109/SCC.2012.87";"IEEE SCC";0
35;"Automated Attribute Inference in Complex Service Workflows Based on Sharing Analysis.";"120-127";2011;"2015-12-02";"http://doi.ieeecomputersociety.org/10.1109/SCC.2011.85";"IEEE SCC";0
36;"Supporting Strategic Decision Making on Service Evolution Context Using Business Intelligence.";"240-247";2013;"2015-12-02";"http://doi.ieeecomputersociety.org/10.1109/SCC.2013.25";"IEEE SCC";0
37;"Cost-Effective Semantic Annotation of XML Schemas and Web Service Interfaces.";"372-379";2009;"2015-12-02";"http://doi.ieeecomputersociety.org/10.1109/SCC.2009.17";"IEEE SCC";0
38;"Building a Service-Oriented Monitoring Framework with REST and Nagios.";"426-431";2011;"2015-12-02";"http://doi.ieeecomputersociety.org/10.1109/SCC.2011.53";"IEEE SCC";0
39;"QRA: A Quality Requirements Analysis Approach for Service Systems.";"25-32";2013;"2015-12-02";"http://doi.ieeecomputersociety.org/10.1109/SCC.2013.48";"IEEE SCC";0
40;"Towards Scaleable and Adaptive Document Routing Services.";"311-314";2006;"2015-12-02";"http://doi.ieeecomputersociety.org/10.1109/SCC.2006.108";"IEEE SCC";0
41;"A Fault-Tolerant Middleware Architecture for High-Availability Storage Services.";"286-293";2007;"2015-12-02";"http://doi.ieeecomputersociety.org/10.1109/SCC.2007.4";"IEEE SCC";0
42;"Dynamic Service Composition in Ambient Intelligence Environment.";"411-418";2009;"2015-12-02";"http://doi.ieeecomputersociety.org/10.1109/SCC.2009.16";"IEEE SCC";0
43;"Web Services - A View from the Top.";"not available";2006;"2015-12-02";"http://doi.ieeecomputersociety.org/10.1109/SCC.2006.115";"IEEE SCC";0
44;"Governance of Cross-Organizational Service Agreements: A Policy-Based Approach.";"36-43";2007;"2015-12-02";"http://doi.ieeecomputersociety.org/10.1109/SCC.2007.63";"IEEE SCC";0
45;"Universal Identity Management Model Based on Anonymous Credentials.";"305-312";2010;"2015-12-02";"http://doi.ieeecomputersociety.org/10.1109/SCC.2010.46";"IEEE SCC";0
46;"Ensuring Coordination of Multi-business Interactions.";"356-363";2009;"2015-12-02";"http://doi.ieeecomputersociety.org/10.1109/SCC.2009.82";"IEEE SCC";0
47;"Toward Intention Aware Semantic Web Service Systems.";"69-76";2005;"2015-12-02";"http://doi.ieeecomputersociety.org/10.1109/SCC.2005.99";"IEEE SCC";0
48;"Déjà Vu: Assessing Similarity between Service Contracts for Risk Prediction.";"147-154";2014;"2015-12-02";"http://doi.ieeecomputersociety.org/10.1109/SCC.2014.28";"IEEE SCC";0
49;"A Dataflow-Pattern-Based Recommendation Approach for Data Service Mashups.";"163-170";2014;"2015-12-02";"http://doi.ieeecomputersociety.org/10.1109/SCC.2014.30";"IEEE SCC";0
50;"iPOJO: an Extensible Service-Oriented Component Framework.";"474-481";2007;"2015-12-02";"http://doi.ieeecomputersociety.org/10.1109/SCC.2007.74";"IEEE SCC";0
51;"A Conceptual Model of Agent Mediated Web Service.";"638-642";2004;"2015-12-02";"http://doi.ieeecomputersociety.org/10.1109/SCC.2004.1358081";"IEEE SCC";0
52;"Configuration Reasoning and Ontology ForWeb.";"387-394";2007;"2015-12-02";"http://doi.ieeecomputersociety.org/10.1109/SCC.2007.44";"IEEE SCC";0
53;"Agent based Resource Brokering and Allocation in Wireless Grids.";"331-334";2006;"2015-12-02";"http://doi.ieeecomputersociety.org/10.1109/SCC.2006.17";"IEEE SCC";0
54;"Towards Self-Aware Performance and Resource Management in Modern Service-Oriented Systems.";"621-624";2010;"2015-12-02";"http://doi.ieeecomputersociety.org/10.1109/SCC.2010.94";"IEEE SCC";0
55;"A Policy-Based Approach for QoS Specification and Enforcement in Distributed Service-Oriented Architecture.";"307-310";2005;"2015-12-02";"http://doi.ieeecomputersociety.org/10.1109/SCC.2005.15";"IEEE SCC";0
56;"Dynamic Architecture for Autonomously Managing Service-Based Applications.";"515-522";2012;"2012-10-08";"http://dx.doi.org/10.1109/SCC.2012.78";"IEEE SCC";0
57;"IoT Mashup as a Service: Cloud-Based Mashup Service for the Internet of Things.";"462-469";2013;"2015-12-02";"http://doi.ieeecomputersociety.org/10.1109/SCC.2013.68";"IEEE SCC";0
58;"Executable Modeling Approach to Service Oriented Architecture Using SoaML in Conjunction with Extended DEVSML.";"243-250";2014;"2015-12-02";"http://doi.ieeecomputersociety.org/10.1109/SCC.2014.40";"IEEE SCC";0
59;"Leveraging Context Aware Services to Transform Evolving Telecom Industry Business Model.";"668-669";2007;"2015-12-02";"http://doi.ieeecomputersociety.org/10.1109/SCC.2007.76";"IEEE SCC";0
60;"Supporting Heterogeneous Applications with Service Oriented Architecture.";"680-681";2007;"2015-12-02";"http://doi.ieeecomputersociety.org/10.1109/SCC.2007.115";"IEEE SCC";0
61;"Reliable Service Composition via Automatic QoS Prediction.";"200-207";2013;"2015-12-02";"http://doi.ieeecomputersociety.org/10.1109/SCC.2013.45";"IEEE SCC";0
62;"Space Profile-Based Reverse Geocoding Service Using Cloud Platform.";"842-843";2014;"2015-12-02";"http://doi.ieeecomputersociety.org/10.1109/SCC.2014.116";"IEEE SCC";0
63;"Cloud Security Issues.";"517-520";2009;"2015-12-02";"http://doi.ieeecomputersociety.org/10.1109/SCC.2009.84";"IEEE SCC";0
64;"A Framework for Assessing Business Value of Service Oriented Architectures.";"670-671";2007;"2015-12-02";"http://doi.ieeecomputersociety.org/10.1109/SCC.2007.7";"IEEE SCC";0
65;"A New Approach for Quality Enforcement in Communities of Web Services.";"472-479";2011;"2015-12-02";"http://doi.ieeecomputersociety.org/10.1109/SCC.2011.44";"IEEE SCC";0
66;"A Contribution to Organizational and Operational Strategic Alignment: Incorporating Business Level Agreements into Business Process Modeling.";"17-24";2013;"2015-12-02";"http://doi.ieeecomputersociety.org/10.1109/SCC.2013.111";"IEEE SCC";0
67;"An Approach to Hosting Versioned Web Services.";"76-82";2007;"2015-12-02";"http://doi.ieeecomputersociety.org/10.1109/SCC.2007.24";"IEEE SCC";0
68;"m3po: An Ontology to Relate Choreographies to Workflow Models.";"19-27";2006;"2015-12-02";"http://doi.ieeecomputersociety.org/10.1109/SCC.2006.65";"IEEE SCC";0
69;"Service Contract Template.";"511";2006;"2015-12-02";"http://doi.ieeecomputersociety.org/10.1109/SCC.2006.89";"IEEE SCC";0
70;"Cloud Service Selection Based on the Aggregation of User Feedback and Quantitative Performance Assessment.";"152-159";2013;"2015-12-02";"http://doi.ieeecomputersociety.org/10.1109/SCC.2013.92";"IEEE SCC";0
71;"IT service management automation - A hybrid methodology to integrate and orchestrate collaborative human centric and automation centric workflows.";"574-581";2007;"2015-12-02";"http://doi.ieeecomputersociety.org/10.1109/SCC.2007.75";"IEEE SCC";0
72;"Rough Formal Concepts and Their Accuracies.";"445-448";2004;"2015-12-02";"http://doi.ieeecomputersociety.org/10.1109/SCC.2004.1358039";"IEEE SCC";0
73;"Text Mining into Distributed Bioinformatics Workflows: A Web Services Implementation.";"145-152";2004;"2015-12-02";"http://doi.ieeecomputersociety.org/10.1109/SCC.2004.1358001";"IEEE SCC";0
74;"Collaborative Business Processes Integration and Management - Lessons learned from industry.";"451-457";2007;"2015-12-02";"http://doi.ieeecomputersociety.org/10.1109/SCC.2007.41";"IEEE SCC";0
75;"Data Decomposition Based Partial Replication Model for Software Services.";"256-263";2013;"2015-12-02";"http://doi.ieeecomputersociety.org/10.1109/SCC.2013.83";"IEEE SCC";0
76;"Information Discovery across Organizational Boundaries through Local Caching.";"522-529";2007;"2015-12-02";"http://doi.ieeecomputersociety.org/10.1109/SCC.2007.70";"IEEE SCC";0
77;"Risk-Aware Web Service Allocation in the Cloud Using Portfolio Theory.";"675-682";2013;"2015-12-02";"http://doi.ieeecomputersociety.org/10.1109/SCC.2013.40";"IEEE SCC";0
78;"Health Identification and Outcome Prediction for Outsourcing Services Based on Textual Comments.";"155-162";2014;"2015-12-02";"http://doi.ieeecomputersociety.org/10.1109/SCC.2014.29";"IEEE SCC";0
79;"A distributed service-oriented mediation tool.";"403-409";2007;"2015-12-02";"http://doi.ieeecomputersociety.org/10.1109/SCC.2007.3";"IEEE SCC";0
80;"Context-Aware Service Recommendation on High Performance Cluster.";"144-151";2013;"2015-12-02";"http://doi.ieeecomputersociety.org/10.1109/SCC.2013.87";"IEEE SCC";0
81;"A Backwards Composition Context Based Service Selection Approach for Service Composition.";"419-426";2009;"2015-12-02";"http://doi.ieeecomputersociety.org/10.1109/SCC.2009.25";"IEEE SCC";0
82;"Reconciliation of Ontology Mappings to Support Robust Service Interoperability.";"298-305";2011;"2015-12-02";"http://doi.ieeecomputersociety.org/10.1109/SCC.2011.83";"IEEE SCC";0
83;"Online Self-Reconfiguration with Performance Guarantee for Energy-Efficient Large-Scale Cloud Computing Data Centers.";"514-521";2010;"2015-12-02";"http://doi.ieeecomputersociety.org/10.1109/SCC.2010.69";"IEEE SCC";0
84;"Introducing EAI and Service Components into Process Management.";"271-276";2004;"2015-12-02";"http://doi.ieeecomputersociety.org/10.1109/SCC.2004.1358015";"IEEE SCC";0
85;"Architecture for Service Request Driven Solution Delivery Using Grid Systems.";"414-422";2006;"2015-12-02";"http://doi.ieeecomputersociety.org/10.1109/SCC.2006.23";"IEEE SCC";0
86;"Design Principles for B2B Services - An Evaluation of Two Alternative Service Designs.";"372-379";2007;"2015-12-02";"http://doi.ieeecomputersociety.org/10.1109/SCC.2007.50";"IEEE SCC";0
87;"Web Content Consistency Through Explicit Ownership Definition.";"531-532";2006;"2015-12-02";"http://doi.ieeecomputersociety.org/10.1109/SCC.2006.114";"IEEE SCC";0
88;"Rain4Service: An Approach towards Decentralized Web Service Composition.";"267-274";2014;"2015-12-02";"http://doi.ieeecomputersociety.org/10.1109/SCC.2014.43";"IEEE SCC";0
89;"Theoretical Framework for Eliminating Redundancy in Workflows.";"41-48";2009;"2015-12-02";"http://doi.ieeecomputersociety.org/10.1109/SCC.2009.19";"IEEE SCC";0
90;"A Fine-grained Parallel Programming Model for Grid Computing.";"613-616";2004;"2015-12-02";"http://doi.ieeecomputersociety.org/10.1109/SCC.2004.1358076";"IEEE SCC";0
91;"Service Spectrum for Service Engineering.";"686-687";2007;"2015-12-02";"http://doi.ieeecomputersociety.org/10.1109/SCC.2007.100";"IEEE SCC";0
92;"A Process Component Model for Enterprise Business Knowledge Reuse.";"409-412";2004;"2015-12-02";"http://doi.ieeecomputersociety.org/10.1109/SCC.2004.1358031";"IEEE SCC";0
93;"Context-Aware Service Adaptation via Learning Classifier System with Co-evolutionary Mechanism.";"679-680";2012;"2013-08-06";"http://dx.doi.org/10.1109/SCC.2012.9";"IEEE SCC";0
94;"Consensus-Based Service Selection Using Crowdsourcing Under Fuzzy Preferences of Users.";"17-26";2014;"2015-12-02";"http://doi.ieeecomputersociety.org/10.1109/SCC.2014.12";"IEEE SCC";0
95;"A Meta-Model Approach for the Deployment of Services-oriented Applications.";"348-355";2007;"2015-12-02";"http://doi.ieeecomputersociety.org/10.1109/SCC.2007.11";"IEEE SCC";0
96;"Service-Based Computing Strategy & Planning.";"not available";2005;"2015-12-02";"http://doi.ieeecomputersociety.org/10.1109/SCC.2005.85";"IEEE SCC";0
97;"Contextual Collaboration: Platform and Applications.";"197-206";2004;"2015-12-02";"http://doi.ieeecomputersociety.org/10.1109/SCC.2004.1358007";"IEEE SCC";0
98;"Dynamic Processor Resource Configuration in Virtualized Environments.";"32-39";2011;"2015-12-02";"http://doi.ieeecomputersociety.org/10.1109/SCC.2011.37";"IEEE SCC";0
99;"Effective Acquisition of Geospatial Data Products in a Collaborative Grid Environment.";"455-462";2006;"2015-12-02";"http://doi.ieeecomputersociety.org/10.1109/SCC.2006.46";"IEEE SCC";0
100;"Task Exception Handling in the VIEW Scientific Workflow System.";"637-638";2010;"2015-12-02";"http://doi.ieeecomputersociety.org/10.1109/SCC.2010.77";"IEEE SCC";0
101;"Business-Driven Trust Federation Management for Service Marketplaces.";"594-601";2010;"2015-12-02";"http://doi.ieeecomputersociety.org/10.1109/SCC.2010.100";"IEEE SCC";0
102;"Grid Service and JCA: An Effective Integration Strategy.";"571-574";2004;"2015-12-02";"http://doi.ieeecomputersociety.org/10.1109/SCC.2004.1358066";"IEEE SCC";0
103;"Business Transformation Based on Cloud Services.";"844-845";2014;"2015-12-02";"http://doi.ieeecomputersociety.org/10.1109/SCC.2014.117";"IEEE SCC";0
104;"Tools and Support for Deploying Applications on the Grid.";"281-287";2004;"2015-12-02";"http://doi.ieeecomputersociety.org/10.1109/SCC.2004.1358016";"IEEE SCC";0
105;"An Information Model for the Provisioning of Network Connections Enabling Customer-Specific End-to-End QoS Guarantees.";"138-145";2010;"2015-12-02";"http://doi.ieeecomputersociety.org/10.1109/SCC.2010.10";"IEEE SCC";0
106;"E-Auctions for Multi-Cloud Service Provisioning.";"35-42";2014;"2015-12-02";"http://doi.ieeecomputersociety.org/10.1109/SCC.2014.14";"IEEE SCC";0
107;"Towards Combining Declarative Specification with On-the-Fly Mediation.";"691-698";2013;"2015-12-02";"http://doi.ieeecomputersociety.org/10.1109/SCC.2013.18";"IEEE SCC";0
108;"A model for extending legacy applications by implementing new requirements as components.";"143-150";2006;"2015-12-02";"http://doi.ieeecomputersociety.org/10.1109/SCC.2006.10";"IEEE SCC";0
109;"Title Page.";"not available";2005;"2015-12-02";"http://doi.ieeecomputersociety.org/10.1109/SCC.2005.8";"IEEE SCC";0
110;"WeBaSeRex: Next Generation Internet Network Design using Web based Remote Execution environments.";"200-210";2005;"2015-12-02";"http://doi.ieeecomputersociety.org/10.1109/SCC.2005.110";"IEEE SCC";0
111;"Ontology-Based Universal Knowledge Grid: Enabling Knowledge Discovery and Integration on the Grid.";"557-560";2004;"2015-12-02";"http://doi.ieeecomputersociety.org/10.1109/SCC.2004.1358063";"IEEE SCC";0
112;"Resource Allocation Based On Workflow For Enhancing the Performance of Composite Service.";"552-559";2007;"2015-12-02";"http://doi.ieeecomputersociety.org/10.1109/SCC.2007.93";"IEEE SCC";0
113;"Automating Service Matchmaking using Type Theory.";"723-724";2007;"2015-12-02";"http://doi.ieeecomputersociety.org/10.1109/SCC.2007.29";"IEEE SCC";0
114;"Business-Activity Driven Search: Addressing the Information Needs of Services Professionals.";"644-651";2007;"2015-12-02";"http://doi.ieeecomputersociety.org/10.1109/SCC.2007.37";"IEEE SCC";0
115;"Semantic based Service-Oriented Grid Architecture for Business Processes.";"423-430";2006;"2015-12-02";"http://doi.ieeecomputersociety.org/10.1109/SCC.2006.86";"IEEE SCC";0
116;"CloudStreamMedia: A Cloud Assistant Global Video on Demand Leasing Scheme.";"486-493";2013;"2015-12-02";"http://doi.ieeecomputersociety.org/10.1109/SCC.2013.91";"IEEE SCC";0
117;"Dynamic Composition of Services in Sensor Networks.";"242-249";2010;"2015-12-02";"http://doi.ieeecomputersociety.org/10.1109/SCC.2010.26";"IEEE SCC";0
118;"Analyzing Impact Factors on Composite Services.";"218-226";2009;"2015-12-02";"http://doi.ieeecomputersociety.org/10.1109/SCC.2009.20";"IEEE SCC";0
119;"Switching Cost, Market Effects and the Pricing Model of e-Commerce.";"403-408";2004;"2015-12-02";"http://doi.ieeecomputersociety.org/10.1109/SCC.2004.1358030";"IEEE SCC";0
120;"The Importance of Considering Information Quality in the Implementation of Service-Oriented Architecture Initiatives.";"583-586";2013;"2015-12-02";"http://doi.ieeecomputersociety.org/10.1109/SCC.2013.22";"IEEE SCC";0
121;"Data Visualization of Web Service with Parallel Coordinates and NodeTrix.";"766-773";2014;"2015-12-02";"http://doi.ieeecomputersociety.org/10.1109/SCC.2014.104";"IEEE SCC";0
122;"Modeling and Configuration of Process Variants for On-Boarding Customers to IT Outsourcing.";"415-422";2012;"2012-10-08";"http://dx.doi.org/10.1109/SCC.2012.32";"IEEE SCC";0
123;"A wavelet based distributed ID model.";"261-263";2005;"2015-12-02";"http://doi.ieeecomputersociety.org/10.1109/SCC.2005.19";"IEEE SCC";0
124;"Enabling Active Data Archival over Cloud.";"98-105";2012;"2012-10-08";"http://dx.doi.org/10.1109/SCC.2012.20";"IEEE SCC";0
125;"SOA based Context Aware Services Infrastructure.";"688-689";2007;"2015-12-02";"http://doi.ieeecomputersociety.org/10.1109/SCC.2007.110";"IEEE SCC";0
126;"QoS-Enabled Business-to-Business Integration Using ebBP to WS-BPEL Translations.";"17-24";2009;"2015-12-02";"http://doi.ieeecomputersociety.org/10.1109/SCC.2009.56";"IEEE SCC";0
127;"The Collaborative Configuration of Service-Oriented Product Lines Based on Evolutionary Approach.";"751-752";2013;"2015-12-02";"http://doi.ieeecomputersociety.org/10.1109/SCC.2013.23";"IEEE SCC";0
128;"A Compliance Aware Software Defined Infrastructure.";"560-567";2014;"2015-12-02";"http://doi.ieeecomputersociety.org/10.1109/SCC.2014.79";"IEEE SCC";0
129;"AWS-Net Traveler: Autonomic Web Services Framework for Autonomic Business Processes.";"270-272";2005;"2015-12-02";"http://doi.ieeecomputersociety.org/10.1109/SCC.2005.34";"IEEE SCC";0
130;"A Granular Concurrency Control for Collaborative Scientific Workflow Composition.";"410-417";2011;"2015-12-02";"http://doi.ieeecomputersociety.org/10.1109/SCC.2011.121";"IEEE SCC";0
131;"Preference-Based Discovery of Dynamically Generated Service Offers.";"338-345";2011;"2015-12-02";"http://doi.ieeecomputersociety.org/10.1109/SCC.2011.12";"IEEE SCC";0
132;"Developing Services for Design Optimisation on the Grid.";"391-398";2004;"2015-12-02";"http://doi.ieeecomputersociety.org/10.1109/SCC.2004.1358029";"IEEE SCC";0
133;"A Service-Oriented Analysis and Design Approach to Developing Adaptable Services.";"204-211";2007;"2015-12-02";"http://doi.ieeecomputersociety.org/10.1109/SCC.2007.16";"IEEE SCC";0
134;"SQL Markup Language for Enterprise Integration.";"413-416";2004;"2011-10-26";"http://doi.ieeecomputersociety.org/10.1109/SCC.2004.1358032";"IEEE SCC";0
135;"A General Attribute based RBAC Model for Web Service.";"236-239";2007;"2015-12-02";"http://doi.ieeecomputersociety.org/10.1109/SCC.2007.8";"IEEE SCC";0
136;"Reckoning Legislative Compliances with Service Oriented Architecture A Proposed Approach.";"16-23";2005;"2015-12-02";"http://doi.ieeecomputersociety.org/10.1109/SCC.2005.77";"IEEE SCC";0
137;"Domain Decomposition for Applications Based on CFD-Grid .";"592-595";2004;"2015-12-02";"http://doi.ieeecomputersociety.org/10.1109/SCC.2004.1358071";"IEEE SCC";0
138;"Applying Bargaining Game Theory to Web Services Negotiation.";"218-225";2010;"2015-12-02";"http://doi.ieeecomputersociety.org/10.1109/SCC.2010.54";"IEEE SCC";0
139;"Towards an Automated Gap Analysis for E-Service Portfolios.";"274-281";2011;"2015-12-02";"http://doi.ieeecomputersociety.org/10.1109/SCC.2011.93";"IEEE SCC";0
140;"An Enhanced QoS Prediction Approach for Service Selection.";"727-728";2011;"2015-12-02";"http://doi.ieeecomputersociety.org/10.1109/SCC.2011.46";"IEEE SCC";0
141;"Correcting Interaction Mismatches for Business Processes.";"457-465";2010;"2015-12-02";"http://doi.ieeecomputersociety.org/10.1109/SCC.2010.53";"IEEE SCC";0
142;"VLAB-C: A Cloud Service Platform for Collaborative Virtual Laboratory.";"829-835";2014;"2015-12-02";"http://doi.ieeecomputersociety.org/10.1109/SCC.2014.112";"IEEE SCC";0
143;"Web Services based SOA for Next Generation Telecom Networks.";"520";2006;"2015-12-02";"http://doi.ieeecomputersociety.org/10.1109/SCC.2006.117";"IEEE SCC";0
144;"Componentization of Business Process Layer in the SOA Reference Architecture.";"316-323";2009;"2015-12-02";"http://doi.ieeecomputersociety.org/10.1109/SCC.2009.85";"IEEE SCC";0
145;"A Benchmark for Web Service Frameworks.";"233-242";2005;"2015-12-02";"http://doi.ieeecomputersociety.org/10.1109/SCC.2005.9";"IEEE SCC";0
146;"Supporting Dynamic Updates of Componentized Service.";"699-700";2007;"2015-12-02";"http://doi.ieeecomputersociety.org/10.1109/SCC.2007.113";"IEEE SCC";0
147;"Performance Antipatterns: Detection and Evaluation of Their Effects in the Cloud.";"758-765";2014;"2015-12-02";"http://doi.ieeecomputersociety.org/10.1109/SCC.2014.103";"IEEE SCC";0
